Product_ID,Material_Name,CAS_Number,Price_US/g,Notes,Is_Dilution,Active_Material,Solvent,Active_%
4EW07503,2 3-Dimethyl Pyrazine from PerfumersWorld,5910-89-4,2.690,,FALSE,,,
5EW07840,2 3-Dimethyl Pyrazine 1% in DPG from PerfumersWorld,"5910-89-4|0.01
25265-71-8|0.99",0.120,,TRUE,2 3-Dimethyl Pyrazine from PerfumersWorld,Dipropylene Glycol (DPG) from PerfumersWorld,1.00%
5EW20137,2 3-Dimethyl Pyrazine 10% in DPG from PerfumersWorld,"5910-89-4|0.1
25265-71-8|0.9",0.290,,TRUE,2 3-Dimethyl Pyrazine from PerfumersWorld,Dipropylene Glycol (DPG) from PerfumersWorld,10.00%
4EW14326,2 Acetyl Thaizole from PerfumersWorld,24295-03-02,2.500,,FALSE,,,
1EN13109,2-Acetyl Pyrazine from PerfumersWorld,22047-25-2,0.710,,FALSE,,,
5EN13769,2-Acetyl Pyrazine 1% in DPG from PerfumersWorld,"22047-25-2|0.01
25265-71-8|0.99",0.100,,TRUE,2-Acetyl Pyrazine from PerfumersWorld,Dipropylene Glycol (DPG) from PerfumersWorld,1.00%
4ES11805,2-iso Propyl 4 Methyl Thiazole from PerfumersWorld,15679-13-7,1.480,,FALSE,,,
5ES13952,2-iso Propyl 4 Methyl Thiazole 1% in DPG from PerfumersWorld,"15679-13-7|0.01
25265-71-8|0.99",0.100,,TRUE,2-iso Propyl 4 Methyl Thiazole from PerfumersWorld,Dipropylene Glycol (DPG) from PerfumersWorld,1.00%
4FC07622,2-Methyl-2-Pentenoic Acid from PerfumersWorld,3142-72-1,0.320,,FALSE,,,
5FC07623,2-Methyl-2-Pentenoic Acid 10% in DPG from PerfumersWorld,"3142-72-1|0.1
25265-71-8|0.9",0.050,,TRUE,2-Methyl-2-Pentenoic Acid from PerfumersWorld,Dipropylene Glycol (DPG) from PerfumersWorld,10.00%
4FD00001,2-Methylbutyl 2-Methylbutyrate from PerfumersWorld,2445-76-3,0.330,,FALSE,,,
4FY22527,2-Octen-4-one from PerfumersWorld,4643-27-0,4.100,,FALSE,,,
0ZH20962,3-Methyl-3-Methoxy Butanol (MMB) from PerfumersWorld,56539-66-3,0.030,,FALSE,,,
1VD00002,6-Methyl Coumarin from PerfumersWorld,92-48-8,0.580,PROHIBITED,FALSE,,,
5VD07562,6-Methyl Coumarin 10% in DPG from PerfumersWorld,"92-48-8|0.1
25265-71-8|0.9",0.180,PROHIBITED,TRUE,6-Methyl Coumarin from PerfumersWorld,Dipropylene Glycol (DPG) from PerfumersWorld,10.00%
6AN18003,A-ALDEHYDE F-TEC from PerfumersWorld,mixture,0.180,,FALSE,,,
6AN07832,A-Aldehyde Fleuressence from PerfumersWorld,mixture,0.200,,FALSE,,,
6NL18079,ACACIA F-TEC from PerfumersWorld,mixture,0.200,,FALSE,,,
6NL08389,Acacia Fleuressence from PerfumersWorld,mixture,0.190,,FALSE,,,
4FG02943,Acetic Acid from PerfumersWorld,64-19-7,0.070,,FALSE,,,
4DV02664,Acetoin from PerfumersWorld,513-86-0,0.920,,FALSE,,,
5DV09244,Acetoin 10% in DPG from PerfumersWorld,"513-86-0|0.1
25265-71-8|0.9",0.130,,TRUE,Acetoin from PerfumersWorld,Dipropylene Glycol (DPG) from PerfumersWorld,10.00%
1NP00009,Acetophenone from PerfumersWorld,98-86-2,0.230,,FALSE,,,
1SP00011,Acetyl Isoeugenol from PerfumersWorld,93-29-8,0.600,,FALSE,,,
5SP07823,Acetyl Isoeugenol 10% in DPG from PerfumersWorld,"93-29-8|0.1
25265-71-8|0.9",0.120,,TRUE,Acetyl Isoeugenol from PerfumersWorld,Dipropylene Glycol (DPG) from PerfumersWorld,10.00%
4GA00012,Adoxal from PerfumersWorld,141-13-9,1.420,,FALSE,,,
5GA08479,Adoxal 10% in DPG from PerfumersWorld,"141-13-9|0.1
25265-71-8|0.9",0.170,,TRUE,Adoxal from PerfumersWorld,Dipropylene Glycol (DPG) from PerfumersWorld,10.00%
6WU18875,AGARWOOD F-TEC from PerfumersWorld,mixture,1.100,,FALSE,,,
6WU08483,Agarwood Fleuressence from PerfumersWorld,mixture,1.600,,FALSE,,,
7WU09890,Agarwood Oil Siam from PerfumersWorld,94350-09-01,25.000,,FALSE,,,
5WU15067,Agarwood Oil Siam 10% in DPG from PerfumersWorld,"94350-09-1|0.1
25265-71-8|0.9",2.800,,TRUE,Agarwood Oil Siam from PerfumersWorld,Dipropylene Glycol (DPG) from PerfumersWorld,10.00%
8WU13317,Agarwood Siam 10% in Nagarmotha Oil from PerfumersWorld,"94350-09-1|0.1
68916-60-9|0.9",3.940,,TRUE,Agarwood Oil Siam from PerfumersWorld,Nagarmotha Oil from PerfumersWorld,10.00%
6CG13368,Agrumen Aldehyde PW from PerfumersWorld,mixture,0.200,,FALSE,,,
3AE13387,Alcohol C-7 Heptanol from PerfumersWorld,111-70-6,0.340,,FALSE,,,
3AD13388,Alcohol C-8 Octanol from PerfumersWorld,111-87-5,0.180,,FALSE,,,
3AD00017,Alcohol C-9 from PerfumersWorld,0143-08-08,0.700,,FALSE,,,
4AC00018,Aldehyde C-10 Decanal from PerfumersWorld,112-31-2,0.170,,FALSE,,,
5AC07527,Aldehyde C-10 Decanal 10% in DPG from PerfumersWorld,"112-31-2|0.1
25265-71-8|0.9",0.080,,TRUE,Aldehyde C-10 Decanal from PerfumersWorld,Dipropylene Glycol (DPG) from PerfumersWorld,10.00%
5AC08459,Aldehyde C-10 Decanal 50% in DPG from PerfumersWorld,"112-31-2|0.5
25265-71-8|0.5",0.120,,TRUE,Aldehyde C-10 Decanal from PerfumersWorld,Dipropylene Glycol (DPG) from PerfumersWorld,50.00%
4AR00020,Aldehyde C-11 Undecanal from PerfumersWorld,112-44-7,0.410,,FALSE,,,
5AR08831,Aldehyde C-11 Undecanal 10% in DPG from PerfumersWorld,"112-44-7|0.1
25265-71-8|0.9",0.110,,TRUE,Aldehyde C-11 Undecanal from PerfumersWorld,Dipropylene Glycol (DPG) from PerfumersWorld,10.00%
4AR01236,Aldehyde C-11 Undecylenic from PerfumersWorld,112-45-8,0.300,,FALSE,,,
5AR08462,Aldehyde C-11 Undecylenic 10% in DPG from PerfumersWorld,"112-45-8|0.1
25265-71-8|0.9",0.070,,TRUE,Aldehyde C-11 Undecylenic from PerfumersWorld,Dipropylene Glycol (DPG) from PerfumersWorld,10.00%
4AA00021,Aldehyde C-12 Lauric Dodecanal from PerfumersWorld,112-54-9,0.250,,FALSE,,,
5AA07834,Aldehyde C-12 Lauric Dodecanal 10% in DPG from PerfumersWorld,"112-54-9|0.1
25265-71-8|0.9",0.060,,TRUE,Aldehyde C-12 Lauric Dodecanal from PerfumersWorld,Dipropylene Glycol (DPG) from PerfumersWorld,10.00%
4AG00022,Aldehyde C-12 MNA from PerfumersWorld,110-41-8,0.280,,FALSE,,,
5AG07528,Aldehyde C-12 MNA 10% in DPG from PerfumersWorld,"110-41-8|0.1
25265-71-8|0.9",0.060,,TRUE,Aldehyde C-12 MNA from PerfumersWorld,Dipropylene Glycol (DPG) from PerfumersWorld,10.00%
4DD00454,Aldehyde C-14 Gamma Undecalactone from PerfumersWorld,104-67-6,0.170,,FALSE,,,
5DD07538,Aldehyde C-14 Gamma Undecalactone 10% in DPG from PerfumersWorld,"104-67-6|0.1
25265-71-8|0.9",0.150,,TRUE,Aldehyde C-14 Gamma Undecalactone from PerfumersWorld,Dipropylene Glycol (DPG) from PerfumersWorld,10.00%
4FC00176,Aldehyde C-16 Ethyl Methyl Phenyl Glycidate from PerfumersWorld,77-83-8,0.140,,FALSE,,,
5FC07539,Aldehyde C-16 Ethyl Methyl Phenyl Glycidate 10% in DPG from PerfumersWorld,"77-83-8|0.1
25265-71-8|0.9",0.060,,TRUE,Aldehyde C-16 Ethyl Methyl Phenyl Glycidate from PerfumersWorld,Dipropylene Glycol (DPG) from PerfumersWorld,10.00%
4DD00324,Aldehyde C-18 Gamma Nonalactone from PerfumersWorld,104-61-0,0.210,,FALSE,,,
5DD12925,Aldehyde C-18 Gamma Nonalactone 10% in DPG from PerfumersWorld,"104-61-0|0.1
25265-71-8|0.9",0.070,,TRUE,Aldehyde C-18 Gamma Nonalactone from PerfumersWorld,Dipropylene Glycol (DPG) from PerfumersWorld,10.00%
4AG00025,Aldehyde C-7 Heptanal from PerfumersWorld,111-71-7,0.620,,FALSE,,,
4AC00026,Aldehyde C-8 Octanal from PerfumersWorld,124-13-0,0.200,,FALSE,,,
5AC08158,Aldehyde C-8 Octanal 10% in DPG from PerfumersWorld,"124-13-0|0.1
25265-71-8|0.9",0.070,,TRUE,Aldehyde C-8 Octanal from PerfumersWorld,Dipropylene Glycol (DPG) from PerfumersWorld,10.00%
4AC00027,Aldehyde C-9 Nonanal from PerfumersWorld,124-19-6,0.240,,FALSE,,,
5AC10167,Aldehyde C-9 Nonanal 10% in DPG from PerfumersWorld,"124-19-6|0.1
25265-71-8|0.9",0.070,,TRUE,Aldehyde C-9 Nonanal from PerfumersWorld,Dipropylene Glycol (DPG) from PerfumersWorld,10.00%
6GN23713,Algenone from PerfumersWorld,mixture,0.400,,FALSE,,,
4GN23714,Algix Pure from PerfumersWorld,mixture,2.250,,FALSE,,,
4FG00029,Allyl Amyl Glycolate from PerfumersWorld,67634-00-8,0.200,,FALSE,,,
5FG07543,Allyl Amyl Glycolate 10% in DPG from PerfumersWorld,"67634-00-8|0.1
25265-71-8|0.9",0.050,,TRUE,Allyl Amyl Glycolate from PerfumersWorld,Dipropylene Glycol (DPG) from PerfumersWorld,10.00%
4FC02995,Allyl Caproate from PerfumersWorld,123-68-2,0.140,,FALSE,,,
4FC00030,Allyl Cyclohexyl Propionate from PerfumersWorld,2705-87-5,0.170,,FALSE,,,
5FC12465,Allyl Cyclohexyl Propionate 10% in DPG from PerfumersWorld,"2705-87-5|0.1
25265-71-8|0.9",0.060,,TRUE,Allyl Cyclohexyl Propionate from PerfumersWorld,Dipropylene Glycol (DPG) from PerfumersWorld,10.00%
4IN10857,Allyl Ionone Cetone V from PerfumersWorld,79-78-7,0.410,,FALSE,,,
9IF02656,Alpha Damascone from PerfumersWorld,24720-09-0,1.900,,FALSE,,,
5IF07569,Alpha Damascone 10% in DPG from PerfumersWorld,"24720-09-0|0.1
25265-71-8|0.9",0.210,,TRUE,Alpha Damascone from PerfumersWorld,Dipropylene Glycol (DPG) from PerfumersWorld,10.00%
3IF00237,Alpha Ionone from PerfumersWorld,127-41-3,0.260,,FALSE,,,
8II00243,Alpha Irone from PerfumersWorld,79-69-6,4.980,,FALSE,,,
5II11436,Alpha Irone 10% in DPG from PerfumersWorld,"79-69-6|0.1
25265-71-8|0.9",0.520,,TRUE,Alpha Irone from PerfumersWorld,Dipropylene Glycol (DPG) from PerfumersWorld,10.00%
5II09179,Alpha Irone 10% in Myristic Acid(solid) from PerfumersWorld,"79-69-6|0.1
544-63-8|0.9",0.570,,TRUE,Alpha Irone from PerfumersWorld,Myristic Acid from PerfumersWorld,10.00%
3IW00300,Alpha Isomethyl Ionone from PerfumersWorld,127-51-5,0.230,,FALSE,,,
3KC14406,Alpha Pinene from PerfumersWorld,80-56-8,0.080,,FALSE,,,
3KL00430,Alpha Terpineol from PerfumersWorld,98-55-5,0.100,,FALSE,,,
4WW17035,Amber Core from PerfumersWorld,139504-68-0,0.460,,FALSE,,,
3WQ11673,Amber Decane from PerfumersWorld,338735-71-0,0.440,,FALSE,,,
6WV18080,AMBER F-TEC from PerfumersWorld,mixture,0.150,,FALSE,,,
6WV12277,Amber Fleuressence from PerfumersWorld,mixture,0.120,,FALSE,,,
6VU09627,Amber Solid from PerfumersWorld,mixture,0.280,,FALSE,,,
6UY18081,AMBERGRIS F-TEC from PerfumersWorld,mixture,0.200,,FALSE,,,
6UY09424,Ambergris Fleuressence from PerfumersWorld,mixture,0.220,,FALSE,,,
4WW16862,Amberketal IPM from PerfumersWorld,"929625-09-0|0.5
110-27-0|0.5",1.820,,FALSE,,,
4WU16860,Ambermax 50% Dowanol TPM from PerfumersWorld,"19870-74-7|0.5
25498-49-1|0.5",0.990,,FALSE,,,
6UQ20900,AMBERNOIR F-TEC from PerfumersWorld,mixture,0.350,,FALSE,,,
6UQ20857,AmberNoir Fleuressence from PerfumersWorld,mixture,0.350,,FALSE,,,
6UQ09624,Amberome Base PW from PerfumersWorld,mixture,1.800,,FALSE,,,
6UV16208,Ambreine Classic PW from PerfumersWorld,mixture,0.800,,FALSE,,,
6VC09625,Ambreine Fleuressence from PerfumersWorld,mixture,0.200,,FALSE,,,
8XU00529,Ambrette Seed Absolute from PerfumersWorld,8015-62-1,20.020,,FALSE,,,
5XU12235,Ambrette Seed Absolute 10% in DPG from PerfumersWorld,"8015-62-1|0.1
25265-71-8|0.9",2.520,,TRUE,Ambrette Seed Absolute from PerfumersWorld,Dipropylene Glycol (DPG) from PerfumersWorld,10.00%
6XU18931,AMBRETTE SEED F-TEC from PerfumersWorld,mixture,0.400,,FALSE,,,
4XU00034,Ambrettolide from PerfumersWorld,7779-50-2,2.500,,FALSE,,,
5XU07617,Ambrettolide 10% in DPG from PerfumersWorld,"7779-50-2|0.1
25265-71-8|0.9",0.270,,TRUE,Ambrettolide from PerfumersWorld,Dipropylene Glycol (DPG) from PerfumersWorld,10.00%
5XU10231,Ambrettolide 50% in DPG from PerfumersWorld,"7779-50-2|0.5
25265-71-8|0.5",1.400,,TRUE,Ambrettolide from PerfumersWorld,Dipropylene Glycol (DPG) from PerfumersWorld,50.00%
1WU21632,Ambrocenide from PerfumersWorld,211299-54-6,4.930,,FALSE,,,
5WU22697,Ambrocenide 10% in DPG from PerfumersWorld,"211299-54-6|0.1
25265-71-8|0.9",0.560,,TRUE,Ambrocenide from PerfumersWorld,Dipropylene Glycol (DPG) from PerfumersWorld,10.00%
5WU22696,Ambrocenide 10% in TEC from PerfumersWorld,"211299-54-6|0.1
77-93-0|0.9",0.580,,TRUE,Ambrocenide from PerfumersWorld,Triethyl Citrate (TEC) from PerfumersWorld,10.00%
1UW16861,Ambrofix from PerfumersWorld,6790-58-5,1.870,,FALSE,,,
1UW00035,Ambrox Super from PerfumersWorld,6790-58-5,1.500,,FALSE,,,
5UW20027,Ambrox Super 10% in DPG from PerfumersWorld,"6790-58-5|0.1
25265-71-8|0.9",0.200,,TRUE,Ambrox Super from PerfumersWorld,Dipropylene Glycol (DPG) from PerfumersWorld,10.00%
1UW00036,Ambroxan from PerfumersWorld,6790-58-5,2.520,,FALSE,,,
5UW07540,Ambroxan 10% in DPG from PerfumersWorld,"6790-58-5|0.1
25265-71-8|0.9",0.370,,TRUE,Ambroxan from PerfumersWorld,Dipropylene Glycol (DPG) from PerfumersWorld,10.00%
3JJ00005,Amyl Cinnamic Aldehyde (ACA) from PerfumersWorld,122-40-7,0.200,,FALSE,,,
3OH00037,Amyl Salicylate from PerfumersWorld,2050-08-0,0.140,,FALSE,,,
4FD06346,Amyl Valerate from PerfumersWorld,2173-56-0,0.950,,FALSE,,,
7WX00917,Amyris Essential Oil from PerfumersWorld,8015-65-4,0.820,,FALSE,,,
4SB00038,Anethole from PerfumersWorld,4180-23-8,0.200,,FALSE,,,
6DU18084,ANIMALISSIMO F-TEC from PerfumersWorld,mixture,0.160,,FALSE,,,
6DU12415,Animalissio Blender Fleuressence from PerfumersWorld,mixture,0.150,,FALSE,,,
3NV00040,Anisaldehyde from PerfumersWorld,0123-11-5,0.260,,FALSE,,,
7SB00041,Anise Essential Oil China from PerfumersWorld,8007-70-3,0.240,,FALSE,,,
3LN00043,Anisyl Acetate from PerfumersWorld,104-21-2,0.280,,FALSE,,,
3NL00044,Anisyl Alcohol from PerfumersWorld,105-13-5,0.200,,FALSE,,,
7WY10413,Anthopogen Essential Oil from PerfumersWorld,8006-76-6,1.800,,FALSE,,,
6FG18856,APPLE F-TEC from PerfumersWorld,mixture,0.160,,FALSE,,,
6FG07793,Apple Fleuressence from PerfumersWorld,mixture,0.220,,FALSE,,,
6FG08058,Apple Green from PerfumersWorld,mixture,0.140,,FALSE,,,
6FG08026,Apple Red from PerfumersWorld,mixture,0.200,,FALSE,,,
0ZA01228,Apricot Oil - Fixed Oil from PerfumersWorld,72869-69-3,0.100,,FALSE,,,
3FD06779,Apritone from PerfumersWorld,68133-79-9,0.780,,FALSE,,,
6WQ18085,ARABIAN OUD F-TEC from PerfumersWorld,mixture,0.350,,FALSE,,,
6WQ08484,Arabian Oud Fleuressence from PerfumersWorld,mixture,0.280,,FALSE,,,
7HH00896,Armoise Essential Oil from PerfumersWorld,8008-93-3,0.990,,FALSE,,,
6HH18090,ARMOISE F-TEC from PerfumersWorld,mixture,0.370,,FALSE,,,
6HH09096,Armoise Fleuressence from PerfumersWorld,mixture,0.350,,FALSE,,,
7WW00915,Atlas Cedarwood Essential Oil from PerfumersWorld,8023-85-3,0.310,,FALSE,,,
5NC12180,Aurantiol (Methyl Anthranilate Schiffs Base) 50% in DPG from PerfumersWorld,"89-43-0|0.5
25265-71-8|0.5",0.220,,TRUE,Aurantiol - Methyl Anthranilate Schiffs Base from PerfumersWorld,Dipropylene Glycol (DPG) from PerfumersWorld,50.00%
2NC00409,Aurantiol - Methyl Anthranilate Schiffs Base from PerfumersWorld,89-43-0,0.370,,FALSE,,,
0ZA01433,Avocado Oil - Fixed Oil from PerfumersWorld,8024-32-6,0.120,,FALSE,,,
4WB16858,Azarbre from PerfumersWorld,68845-00-1,0.400,,FALSE,,,
6BB18004,B-ICEBERG F-TEC from PerfumersWorld,mixture,0.120,,FALSE,,,
6BB07833,B-iceBerg Fleuressence from PerfumersWorld,mixture,0.200,,FALSE,,,
6FD18188,BANANA F-TEC from PerfumersWorld,mixture,0.150,,FALSE,,,
6FD09062,Banana Fleuressence from PerfumersWorld,mixture,0.260,,FALSE,,,
6PS18638,BASIL F-TEC from PerfumersWorld,mixture,0.350,,FALSE,,,
6PS12413,Basil Fleuressence from PerfumersWorld,mixture,0.180,,FALSE,,,
7SP00048,Bay West Indies Essential Oil from PerfumersWorld,8006-78-8,1.300,,FALSE,,,
5SP07871,Bay West Indies Essential Oil 10% in DPG from PerfumersWorld,"8006-78-8|0.1
25265-71-8|0.9",0.150,,TRUE,Bay West Indies Essential Oil 10% in DPG from PerfumersWorld,Dipropylene Glycol (DPG) from PerfumersWorld,10.00%
2QV23712,Benjoin Laos Matured from PerfumersWorld,9000-05-09,0.600,,FALSE,,,
4FN00049,Benzaldehyde from PerfumersWorld,100-52-7,0.180,,FALSE,,,
5FN07794,Benzaldehyde 10% in DPG from PerfumersWorld,"100-52-7|0.1
25265-71-8|0.9",0.070,,TRUE,Benzaldehyde from PerfumersWorld,Dipropylene Glycol (DPG) from PerfumersWorld,10.00%
6QV18435,BENZOIN F-TEC from PerfumersWorld,mixture,0.250,,FALSE,,,
6QV09111,Benzoin Fleuressence from PerfumersWorld,mixture,0.350,,FALSE,,,
2QV00050,Benzoin Siam Resinoid from PerfumersWorld,9000-72-0,0.600,,FALSE,,,
5QV07505,Benzoin Siam Resinoid 50% in BB from PerfumersWorld,"9000-72-0|0.5
120-51-4|0.5",0.350,,TRUE,Benzoin Siam Resinoid from PerfumersWorld,Benzyl Benzoate (BB) from PerfumersWorld,50.00%
5QV13027,Benzoin Siam Resinoid 50% in DPG from PerfumersWorld,"9000-72-0|0.5
25265-71-8|0.5",0.340,,TRUE,Benzoin Siam Resinoid from PerfumersWorld,Dipropylene Glycol (DPG) from PerfumersWorld,50.00%
2QV08253,Benzoin Sumatra Resinoid from PerfumersWorld,9000-73-1,0.400,,FALSE,,,
1RP00051,Benzophenone from PerfumersWorld,119-61-9,0.150,,FALSE,,,
5RP09245,Benzophenone 10% in DPG from PerfumersWorld,"119-61-9|0.1
25265-71-8|0.9",0.080,,TRUE,Benzophenone from PerfumersWorld,Dipropylene Glycol (DPG) from PerfumersWorld,10.00%
3JF00052,Benzyl Acetate from PerfumersWorld,0140-11-4,0.200,,FALSE,,,
0ZN00053,Benzyl Alcohol (BA) from PerfumersWorld,100-51-6,0.200,,FALSE,,,
0ZN00054,Benzyl Benzoate (BB) from PerfumersWorld,120-51-4,0.200,,FALSE,,,
4JD00055,Benzyl Butyrate from PerfumersWorld,103-37-7,0.200,,FALSE,,,
2SQ00056,Benzyl Cinnamate from PerfumersWorld,103-41-3,0.250,,FALSE,,,
5SQ12479,Benzyl Cinnamate 10% in DPG from PerfumersWorld,"103-41-3|0.1
25265-71-8|0.9",0.060,,TRUE,Benzyl Cinnamate from PerfumersWorld,Dipropylene Glycol (DPG) from PerfumersWorld,10.00%
4JW00057,Benzyl Formate from PerfumersWorld,104-57-4,0.840,,FALSE,,,
1SP00058,Benzyl Isoeugenol from PerfumersWorld,0120-11-6,0.700,,FALSE,,,
5SP12480,Benzyl Isoeugenol 10% in DPG from PerfumersWorld,"120-11-6|0.1
25265-71-8|0.9",0.100,,TRUE,Benzyl Isoeugenol from PerfumersWorld,Dipropylene Glycol (DPG) from PerfumersWorld,10.00%
3JF00059,Benzyl Propionate from PerfumersWorld,122-63-4,0.090,,FALSE,,,
3ON00060,Benzyl Salicylate from PerfumersWorld,118-58-1,0.090,,FALSE,,,
7CL00061,Bergamot Essential Oil from PerfumersWorld,8007-75-8,0.350,,FALSE,,,
6CL18898,BERGAMOT F-TEC from PerfumersWorld,mixture,0.180,,FALSE,,,
7CL24020,Bergamot FCF oil Sicilian from PerfumersWorld,68648-33-9,0.220,,FALSE,,,
6CL09058,Bergamot Fleuressence from PerfumersWorld,mixture,0.200,,FALSE,,,
3FG19149,Berry Hexanoate (BerryFlor) from PerfumersWorld,131433-28-6,1.100,,FALSE,,,
3WS00089,Beta Caryophyllene from PerfumersWorld,87-44-5,0.140,,FALSE,,,
9IR00141,Beta Damascone from PerfumersWorld,23726-91-2,3.180,,FALSE,,,
5IR07532,Beta Damascone 10% in DPG from PerfumersWorld,"23726-91-2|0.1
25265-71-8|0.9",0.350,,TRUE,Beta Damascone from PerfumersWorld,Dipropylene Glycol (DPG) from PerfumersWorld,10.00%
4BC11314,Beta Homocyclocitral from PerfumersWorld,472-66-2,7.600,,FALSE,,,
3IF00238,Beta Ionone from PerfumersWorld,14901-07-06,0.290,,FALSE,,,
3KC00386,Beta Pinene from PerfumersWorld,127-91-3,0.060,,FALSE,,,
5TP07825,Birch Tar Essential Oil 1% in DPG from PerfumersWorld,"8001-88-5|0.01
25265-71-8|0.99",0.150,,TRUE,Birch Tar Oil Rectified 10% in DPG from PerfumersWorld,Dipropylene Glycol (DPG) from PerfumersWorld,1.00%
7TP00822,Birch Tar Oil Rectified from PerfumersWorld,8001-88-5,2.100,,FALSE,,,
5TP11094,Birch Tar Oil Rectified 10% in DPG from PerfumersWorld,"8001-88-5|0.1
25265-71-8|0.9",0.250,,TRUE,Birch Tar Oil Rectified from PerfumersWorld,Dipropylene Glycol (DPG) from PerfumersWorld,10.00%
7CA00849,Bitter Orange Essential Oil from PerfumersWorld,8008-57-9,0.460,,FALSE,,,
6WU07708,Black Agarwood Artificial from PerfumersWorld,mixture,1.700,,FALSE,,,
7SQ00359,Black Pepper Essential Oil from PerfumersWorld,8006-82-4,1.000,,FALSE,,,
6SH18444,BLACK PEPPER F-TEC from PerfumersWorld,mixture,0.300,,FALSE,,,
6SH09677,Black Pepper Fleuressence from PerfumersWorld,mixture,0.500,,FALSE,,,
6HE09224,Black Tea Base from PerfumersWorld,mixture,0.290,,FALSE,,,
8FB00063,Blackcurrant Absolute from PerfumersWorld,68606-81-5,7.100,,FALSE,,,
5FB20096,Blackcurrant Absolute 10% in DPG from PerfumersWorld,"68606-81-5|0.1
25265-71-8|0.9",0.640,,TRUE,Blackcurrant Absolute from PerfumersWorld,Dipropylene Glycol (DPG) from PerfumersWorld,10.00%
6FB18179,BLACKCURRANT F-TEC from PerfumersWorld,mixture,0.320,,FALSE,,,
6FB09427,Blackcurrant Fleuressence from PerfumersWorld,mixture,0.300,,FALSE,,,
7CA24032,Blood Orange oil Sicilian from PerfumersWorld,8008-57-9,0.180,,FALSE,,,
7HF00102,Blue Chamomile Essential Oil from PerfumersWorld,8002-66-2,2.120,,FALSE,,,
5HF07844,Blue Chamomile Essential Oil 10% in DPG from PerfumersWorld,"8002-66-2|0.1
25265-71-8|0.9",0.240,,TRUE,Blue Chamomile Essential Oil from PerfumersWorld,Dipropylene Glycol (DPG) from PerfumersWorld,10.00%
6LW18324,BOIS DE ROSE F-TEC from PerfumersWorld,mixture,0.160,,FALSE,,,
6LW12346,Bois de Rose Fleuressence from PerfumersWorld,mixture,0.270,,FALSE,,,
1BW00064,Borneol from PerfumersWorld,507-70-0,0.140,,FALSE,,,
5BW12462,Borneol 50% in DPG from PerfumersWorld,"507-70-0|0.5
25265-71-8|0.5",0.070,,TRUE,Borneol from PerfumersWorld,Dipropylene Glycol (DPG) from PerfumersWorld,50.00%
4MA00067,Bourgeonal from PerfumersWorld,18127-01-0,0.520,,FALSE,,,
5MA12469,Bourgeonal 10% in DPG from PerfumersWorld,"18127-01-0|0.1
25265-71-8|0.9",0.090,,TRUE,Bourgeonal from PerfumersWorld,Dipropylene Glycol (DPG) from PerfumersWorld,10.00%
6NL18792,BROOM F-TEC from PerfumersWorld,mixture,0.170,,FALSE,,,
6NL08427,Broom Fleuressence from PerfumersWorld,mixture,0.180,,FALSE,,,
1FB00071,Buccoxime from PerfumersWorld,95962-14-4,2.800,,FALSE,,,
5FB07818,Buccoxime 10% in DPG from PerfumersWorld,"95962-14-4|0.1
25265-71-8|0.9",0.320,,TRUE,Buccoxime from PerfumersWorld,Dipropylene Glycol (DPG) from PerfumersWorld,10.00%
3FD05860,Butyl Butyrate from PerfumersWorld,109-21-7,0.110,,FALSE,,,
4FD05871,Butyl Isovalerate from PerfumersWorld,109-19-3,0.240,,FALSE,,,
3OH00073,Butyl Salicylate from PerfumersWorld,2052-14-4,0.100,,FALSE,,,
0ZP03359,Butylated Hydroxytoluene (BHT) antioxidant from PerfumersWorld,128-37-0,0.090,,FALSE,,,
6CL18060,C-CITRUS F-TEC from PerfumersWorld,mixture,0.200,,FALSE,,,
6CL07830,C-Citrus Fleuressence from PerfumersWorld,mixture,0.220,,FALSE,,,
7LW00863,Cabreuva Essential Oil from PerfumersWorld,68188-03-04,0.750,,FALSE,,,
7TW00076,Cade Oil Rectified from PerfumersWorld,8013-10-3,0.700,,FALSE,,,
5TW10962,Cade Oil Rectified 10% in DPG from PerfumersWorld,"8013-10-3|0.1
25265-71-8|0.9",0.200,,TRUE,Cade Oil Rectified from PerfumersWorld,Dipropylene Glycol (DPG) from PerfumersWorld,10.00%
5TW07824,Cade Oil Rectified Oil 1% in DPG from PerfumersWorld,"8013-10-3|0.01
25265-71-8|0.99",0.110,,TRUE,Cade Oil Rectified from PerfumersWorld,Dipropylene Glycol (DPG) from PerfumersWorld,1.00%
7BH00912,Cajuput Essential Oil from PerfumersWorld,8008-98-8,0.360,,FALSE,,,
1YG00077,Calone from PerfumersWorld,28940-11-6,4.460,,FALSE,,,
5YG11098,Calone 1% in DPG from PerfumersWorld,"28940-11-6|0.01
25265-71-8|0.99",0.060,,TRUE,Calone from PerfumersWorld,Dipropylene Glycol (DPG) from PerfumersWorld,1.00%
5YG07546,Calone 10% in DPG from PerfumersWorld,"28940-11-6|0.1
25265-71-8|0.9",0.470,,TRUE,Calone,Dipropylene Glycol (DPG) from PerfumersWorld,10.00%
3BH00078,Camphene from PerfumersWorld,79-92-5,0.170,,FALSE,,,
6BH18118,CAMPHOR F-TEC from PerfumersWorld,mixture,0.150,,FALSE,,,
1BH00080,Camphor Powder from PerfumersWorld,76-22-2,0.100,,FALSE,,,
5BH09580,Camphor Powder 50% in DPG from PerfumersWorld,"76-22-2|0.5
25265-71-8|0.5",0.090,,TRUE,Camphor Powder from PerfumersWorld,Dipropylene Glycol (DPG) from PerfumersWorld,50.00%
7BH00079,Camphor White Essential Oil from PerfumersWorld,8008-51-3,0.270,,FALSE,,,
6BH09017,Camphoraceous Fleuressence from PerfumersWorld,mixture,0.190,,FALSE,,,
7NJ00081,Cananga Essential Oil from PerfumersWorld,68606-83-7,0.300,,FALSE,,,
5VE14325,Caramel Furanone 0.003% from PerfumersWorld,"3658-77-3|0.00003
57-55-6|0.99997",0.120,,FALSE,,,
5VE14324,Caramel Furanone 0.03% from PerfumersWorld,"3658-77-3|0.0003
57-55-6|0.9997",0.170,,FALSE,,,
7SE00083,Caraway Seed Essential Oil from PerfumersWorld,8000-42-8,0.820,,FALSE,,,
5SE07843,Caraway Seed Essential Oil 10% in DPG from PerfumersWorld,"8000-42-8|0.1
25265-71-8|0.9",0.120,,TRUE,Caraway Seed Essential Oil from PerfumersWorld,Dipropylene Glycol (DPG) from PerfumersWorld,10.00%
7SC00084,Cardamom Essential Oil from PerfumersWorld,8000-66-6,3.560,,FALSE,,,
5SC07859,Cardamom Essential Oil 10% in DPG from PerfumersWorld,"8000-66-6|0.1
25265-71-8|0.9",0.420,,TRUE,Cardamom Essential Oil from PerfumersWorld,Dipropylene Glycol (DPG) from PerfumersWorld,10.00%
6SC09679,Cardamom Fleuressence from PerfumersWorld,mixture,0.860,,FALSE,,,
6SC18557,CARDAMON F-TEC from PerfumersWorld,mixture,0.500,,FALSE,,,
6SP18441,CARNATION F-TEC from PerfumersWorld,mixture,0.220,,FALSE,,,
6SP09163,Carnation Fleuressence from PerfumersWorld,mixture,0.220,,FALSE,,,
7IS00086,Carrot Seed Essential Oil from PerfumersWorld,8015-88-1,4.000,,FALSE,,,
5IS07846,Carrot Seed Essential Oil 10% in DPG from PerfumersWorld,"8015-88-1|0.1
25265-71-8|0.9",0.500,,TRUE,Carrot Seed Essential Oil from PerfumersWorld,Dipropylene Glycol (DPG) from PerfumersWorld,10.00%
3WI03465,Caryophyllene Acetate from PerfumersWorld,57082-24-3,0.100,,FALSE,,,
4XB00090,Cashmeran from PerfumersWorld,33704-61-9,0.520,,FALSE,,,
5XB07615,Cashmeran 10% in DPG from PerfumersWorld,"33704-61-9|0.1
25265-71-8|0.9",0.100,,TRUE,Cashmeran from PerfumersWorld,Dipropylene Glycol (DPG) from PerfumersWorld,10.00%
6XB18881,CASHMERE MUSK F-TEC from PerfumersWorld,mixture,0.250,,FALSE,,,
6XB09681,Cashmere Musk Fleuressence from PerfumersWorld,mixture,0.230,,FALSE,,,
7SV00091,Cassia Essential Oil from PerfumersWorld,8007-80-5,0.350,,FALSE,,,
5SV12481,Cassia Essential Oil 10% in DPG from PerfumersWorld,"8007-80-5|0.1
25265-71-8|0.9",0.070,,TRUE,Cassia Essential Oil from PerfumersWorld,Dipropylene Glycol (DPG) from PerfumersWorld,10.00%
6NI18791,CASSIE F-TEC from PerfumersWorld,mixture,0.300,,FALSE,,,
6NI09419,Cassie Fleuressence from PerfumersWorld,mixture,0.250,,FALSE,,,
6UP18499,CASTOREUM F-TEC from PerfumersWorld,mixture,0.240,,FALSE,,,
6UP11559,Castoreum Fleuressence from PerfumersWorld,mixture,0.370,,FALSE,,,
6UP07515,Castoreum Synthetic from PerfumersWorld,mixture,2.020,,FALSE,,,
7WP00844,Cedarwood Chinese Essential Oil from PerfumersWorld,85085-29-6,0.130,,FALSE,,,
6WW18687,CEDARWOOD F-TEC from PerfumersWorld,mixture,0.280,,FALSE,,,
6WW09124,Cedarwood Fleuressence from PerfumersWorld,mixture,0.300,,FALSE,,,
7WW00095,Cedarwood Virginian Essential Oil from PerfumersWorld,8000-27-9,0.300,,FALSE,,,
3WW00097,Cedramber from PerfumersWorld,19033-51-1,0.240,,FALSE,,,
