Product_ID,Material_Name,CAS_Number,Price_US/g,Notes,Is_Dilution,Active_Material,Solvent,Active_%
7CC24028,Cedrat FCF oil Sicilian from PerfumersWorld,8008-56-8,0.350,,FALSE,,,
1WW00096,Cedrenyl Acetate from PerfumersWorld,77-54-3,0.280,,FALSE,,,
1WW01281,Cedrol from PerfumersWorld,77-53-2,0.240,,FALSE,,,
5WW09974,Cedrol 10% in DPG from PerfumersWorld,"77-53-2|0.1
25265-71-8|0.9",0.060,,TRUE,Cedrol from PerfumersWorld,Dipropylene Glycol (DPG) from PerfumersWorld,10.00%
3WI00098,Cedroxyde from PerfumersWorld,71735-79-0,0.690,,FALSE,,,
2WW00099,Cedryl Acetate from PerfumersWorld,77-54-3,0.210,,FALSE,,,
7SH00100,Celery Seed Essential Oil from PerfumersWorld,8015-90-5,0.940,,FALSE,,,
5SH07845,Celery Seed Essential Oil 10% in DPG from PerfumersWorld,"8015-90-5|0.1
25265-71-8|0.9",0.130,,TRUE,Celery Seed Essential Oil 10% in DPG from PerfumersWorld,Dipropylene Glycol (DPG) from PerfumersWorld,10.00%
1XY00101,Celestolide from PerfumersWorld,13171-00-1,0.310,,FALSE,,,
5XY10869,Celestolide 10% in DPG from PerfumersWorld,"13171-00-1|0.1
25265-71-8|0.9",0.120,,TRUE,Celestolide 10% in DPG from PerfumersWorld,Dipropylene Glycol (DPG) from PerfumersWorld,10.00%
6NJ18626,CHAMPACA F-TEC from PerfumersWorld,mixture,0.250,,FALSE,,,
6NJ09072,Champaca Fleuressence from PerfumersWorld,mixture,0.390,,FALSE,,,
7NJ07740,Champaca Flower Essential Oil from PerfumersWorld,8006-76-6,2.540,,FALSE,,,
5NN07927,Champaca Flower Essential Oil 10% in DPG from PerfumersWorld,"8006-76-6|0.1
25265-71-8|0.9",0.270,,TRUE,Champaca Flower Essential Oil from PerfumersWorld,Dipropylene Glycol (DPG) from PerfumersWorld,10.00%
7LN08199,Champaca Leaf Essential Oil from PerfumersWorld,92457-18-6,0.550,,FALSE,,,
4YE09171,Champignol from PerfumersWorld,82461-14-1,10.450,,FALSE,,,
5YE12329,Champignol 10% in DPG from PerfumersWorld,"82461-14-1|0.1
25265-71-8|0.9",1.100,,TRUE,Champignol from PerfumersWorld,Dipropylene Glycol (DPG) from PerfumersWorld,10.00%
6FN18183,CHERRY F-TEC from PerfumersWorld,mixture,0.150,,FALSE,,,
6FN09071,Cherry Fleuressence from PerfumersWorld,mixture,0.200,,FALSE,,,
6VE18548,CHOCOLATE F-TEC from PerfumersWorld,mixture,0.250,,FALSE,,,
6VE12421,Chocolate Fleuressence from PerfumersWorld,mixture,0.580,,FALSE,,,
6CL11946,Chrome Citrus Fleuressence from PerfumersWorld,mixture,0.120,,FALSE,,,
6CL18125,CHROME F-TEC from PerfumersWorld,mixture,0.120,,FALSE,,,
6UX18493,CHYPRE F-TEC from PerfumersWorld,mixture,0.170,,FALSE,,,
6UX10406,Chypre Fleuressence from PerfumersWorld,mixture,0.280,,FALSE,,,
7SV00107,Cinnamon Bark Essential Oil from PerfumersWorld,8015-91-6,2.200,,FALSE,,,
5SV11510,Cinnamon Bark Essential Oil 10% in DPG from PerfumersWorld,"8015-91-6|0.1
25265-71-8|0.9",0.240,,TRUE,Cinnamon Bark Essential Oil from PerfumersWorld,Dipropylene Glycol (DPG) from PerfumersWorld,10.00%
6SV18443,CINNAMON F-TEC from PerfumersWorld,mixture,0.120,,FALSE,,,
6SV08501,Cinnamon Fleuressence from PerfumersWorld,mixture,0.200,,FALSE,,,
7SV00108,Cinnamon Leaf Essential Oil from PerfumersWorld,8015-91-6,0.400,,FALSE,,,
3SQ00109,Cinnamyl Acetate from PerfumersWorld,103-54-8,0.180,,FALSE,,,
2SV00105,Cinnamyl Alcohol from PerfumersWorld,104-54-1,0.200,,FALSE,,,
5SV07857,Cinnamyl Alcohol 50% in DPG from PerfumersWorld,"104-54-1|0.5
25265-71-8|0.5",0.120,,TRUE,Cinnamyl Alcohol from PerfumersWorld,Dipropylene Glycol (DPG) from PerfumersWorld,50.00%
4SV00106,Cinnamyl Aldehyde from PerfumersWorld,104-55-2,0.130,,FALSE,,,
5SV10991,Cinnamyl aldehyde 10% in DPG from PerfumersWorld,"104-55-2|0.1
25265-71-8|0.9",0.050,,TRUE,Cinnamyl Aldehyde from PerfumersWorld,Dipropylene Glycol (DPG) from PerfumersWorld,10.00%
4SW23710,Cinnamyl Nitrile from PerfumersWorld,1885-38-7,0.400,,FALSE,,,
4GL00225,cis-3 Hexenol from PerfumersWorld,928-96-1,0.480,,FALSE,,,
5GG07890,cis-3 Hexenol 10% in DPG from PerfumersWorld,"928-96-1|0.1
25265-71-8|0.9",0.110,,TRUE,cis-3 Hexenol from PerfumersWorld,Dipropylene Glycol (DPG) from PerfumersWorld,10.00%
4GF00226,cis-3 Hexenyl Acetate from PerfumersWorld,3681-71-8,0.720,,FALSE,,,
5GF07561,cis-3 Hexenyl Acetate 10% in DPG from PerfumersWorld,"3681-71-8|0.1
25265-71-8|0.9",0.120,,TRUE,cis-3 Hexenyl Acetate from PerfumersWorld,Dipropylene Glycol (DPG) from PerfumersWorld,10.00%
3GN00227,cis-3 Hexenyl Benzoate from PerfumersWorld,25152-85-6,0.820,,FALSE,,,
4GD00228,cis-3 Hexenyl Butyrate from PerfumersWorld,16491-36-4,0.900,,FALSE,,,
5GD08173,cis-3 Hexenyl Butyrate 10% in DPG from PerfumersWorld,"16491-36-4|0.1
25265-71-8|0.9",0.070,,TRUE,cis-3 Hexenyl Butyrate from PerfumersWorld,Dipropylene Glycol (DPG) from PerfumersWorld,10.00%
4GG01946,cis-3 Hexenyl Hexanoate from PerfumersWorld,31501-11-8,0.600,,FALSE,,,
3GO00229,cis-3 Hexenyl Salicylate from PerfumersWorld,65405-77-8,0.520,,FALSE,,,
5GO12259,cis-3 Hexenyl Salicylate 10% in DPG from PerfumersWorld,"65405-77-8|0.1
25265-71-8|0.9",0.100,,TRUE,cis-3 Hexenyl Salicylate from PerfumersWorld,Dipropylene Glycol (DPG) from PerfumersWorld,10.00%
4JN00257,cis-Jasmone from PerfumersWorld,0488-10-8,2.140,,FALSE,,,
5JN07525,cis-Jasmone 10% in DPG from PerfumersWorld,"488-10-8|0.1
25265-71-8|0.9",0.320,,TRUE,cis-Jasmone from PerfumersWorld,Dipropylene Glycol (DPG) from PerfumersWorld,10.00%
8UQ00540,Cistus Absolute F0779 (BIOLANDES) from PerfumersWorld,8016-26-0,0.900,,FALSE,,,
8UQ08229,Cistus Absolute SIS F0785 (BIOLANDES) from PerfumersWorld,8016-26-0,1.500,,FALSE,,,
7UQ08239,Cistus Essential Oil from PerfumersWorld,8016-26-0,4.800,,FALSE,,,
5UQ14582,Cistus Essential Oil 10% in DPG from PerfumersWorld,"8016-26-0|0.1
25265-71-8|0.9",0.500,,TRUE,Cistus Essential Oil from PerfumersWorld,Dipropylene Glycol (DPG) from PerfumersWorld,10.00%
4CC00111,Citral from PerfumersWorld,5392-40-5,0.160,,FALSE,,,
5CC07796,Citral 10% in DPG from PerfumersWorld,"5392-40-5|0.1
25265-71-8|0.9",0.070,,TRUE,Citral from PerfumersWorld,Dipropylene Glycol (DPG) from PerfumersWorld,10.00%
5CC07820,Citralva 10% in DPG from PerfumersWorld,"5146-66-7|0.1
25265-71-8|0.9",0.070,PROHIBITED,FALSE,,,10.00%
3CC00112,Citrathal from PerfumersWorld,31906-04-04,0.480,,FALSE,,,
1ZX03525,Citric Acid from PerfumersWorld,77-92-9,0.080,,FALSE,,,
7CR00114,Citronella Essential Oil from PerfumersWorld,8000-29-1,0.140,,FALSE,,,
4CR00115,CitronellAL from PerfumersWorld,106-23-0,0.120,,FALSE,,,
5CR07548,CitronellAL 10% in DPG from PerfumersWorld,"106-23-0|0.1
25265-71-8|0.9",0.070,,TRUE,CitronellAL from PerfumersWorld,Dipropylene Glycol (DPG) from PerfumersWorld,10.00%
3RM00116,CitronellOL from PerfumersWorld,106-22-9,0.220,,FALSE,,,
3RL00118,Citronellyl Acetate from PerfumersWorld,150-84-5,0.180,,FALSE,,,
4RC03548,Citronellyl Formate from PerfumersWorld,105-85-1,0.180,,FALSE,,,
4CR06787,Citronellyl Nitrile from PerfumersWorld,51566-62-2,0.220,,FALSE,,,
6AC18110,CITRUS ALDEHYDE F-TEC from PerfumersWorld,mixture,0.120,,FALSE,,,
6AC09112,Citrus Aldehyde Fleuressence from PerfumersWorld,mixture,0.200,,FALSE,,,
7CK01152,Citrus Hystrix Lime Essential Oil from PerfumersWorld,91771-50-5,0.230,,FALSE,,,
7CK01077,Citrus Hystrix Lime Leaf Essential Oil from PerfumersWorld,91771-50-5,0.560,,FALSE,,,
3UU07513,Civet Art from PerfumersWorld,mixture,2.700,,FALSE,,,
5UU07533,Civet Art 10% in DPG from PerfumersWorld,mixture,0.270,,TRUE,Civet Art from PerfumersWorld,Dipropylene Glycol (DPG) from PerfumersWorld,10.00%
6UU18497,CIVET F-TEC from PerfumersWorld,mixture,0.320,,FALSE,,,
6UU09106,Civet Fleuressence from PerfumersWorld,mixture,0.300,,FALSE,,,
7HH00121,Clary Sage Essential Oil from PerfumersWorld,8016-63-5,1.440,,FALSE,,,
6SC18558,CLASSIC SPICE F-TEC from PerfumersWorld,mixture,0.190,,FALSE,,,
6SC12411,Classic Spice Fleuressence from PerfumersWorld,mixture,0.220,,FALSE,,,
6GM12399,Clear Green Blender Fleuressence from PerfumersWorld,mixture,0.220,,FALSE,,,
6GM18236,CLEAR GREEN F-TEC from PerfumersWorld,mixture,0.190,,FALSE,,,
3WB13402,Clearwood from PerfumersWorld,1238515-83-5,0.340,,FALSE,,,
7SP00122,Clove Bud Essential Oil from PerfumersWorld,8000-34-8,0.540,,FALSE,,,
6SP18442,CLOVE F-TEC from PerfumersWorld,mixture,0.140,,FALSE,,,
6SP09088,Clove Fleuressence from PerfumersWorld,mixture,0.200,,FALSE,,,
7SP00123,Clove Leaf Essential Oil from PerfumersWorld,8015-97-2,0.190,,FALSE,,,
8VT00635,Cocoa Absolute from PerfumersWorld,8002-31-1,3.520,,FALSE,,,
5VT07920,Cocoa Absolute 10% in DPG from PerfumersWorld,"8002-31-1|0.1
25265-71-8|0.9",0.380,,TRUE,Cocoa Absolute from PerfumersWorld,Dipropylene Glycol (DPG) from PerfumersWorld,10.00%
5VT08034,Cocoa Absolute 10% in IPM from PerfumersWorld,"8002-31-1|0.1
110-27-0|0.9",0.390,,TRUE,Cocoa Absolute from PerfumersWorld,Isopropyl Myristate (IPM) from PerfumersWorld,10.00%
8VT23451,Cocoa absolute grasse from PerfumersWorld,8002-31-1,4.900,,FALSE,,,
5VT23692,Cocoa absolute grasse 10% in DPG from PerfumersWorld,"8002-31-1|0.1
25265-71-8|0.9",0.530,,TRUE,Cocoa absolute grasse from PerfumersWorld,Dipropylene Glycol (DPG) from PerfumersWorld,10.00%
6DV18549,COCOA BUTTER F-TEC from PerfumersWorld,mixture,0.120,,FALSE,,,
6DV09055,Cocoa Butter Fleuressence from PerfumersWorld,mixture,0.140,,FALSE,,,
1VT23924,Cocoa CO2 Extract from PerfumersWorld,84649-99-0,1.500,,FALSE,,,
6DV18143,COCONUT F-TEC from PerfumersWorld,mixture,0.180,,FALSE,,,
6DV12422,Coconut Fleuressence from PerfumersWorld,mixture,0.180,,FALSE,,,
0ZV22213,Coconut Oil Fractionated (Coconut MCT) Fixed Oil from PerfumersWorld,73398-61-5,0.080,,FALSE,,,
8TE23450,Coffee absolute grasse from PerfumersWorld,8001-67-0,6.200,,FALSE,,,
5TE23680,Coffee absolute grasse 10% in DPG from PerfumersWorld,"8001-67-0|0.1
25265-71-8|0.9",0.650,,TRUE,Coffee absolute grasse from PerfumersWorld,Dipropylene Glycol (DPG) from PerfumersWorld,10.00%
8ET23923,Coffee CO2 Extract Organic from PerfumersWorld,84650-00-0,2.000,,FALSE,,,
6ET18954,COFFEE F-TEC from PerfumersWorld,mixture,0.300,,FALSE,,,
6ET20539,Coffee Fleuressence from PerfumersWorld,mixture,0.300,,FALSE,,,
7ET08078,Coffee Oil Roasted from PerfumersWorld,8001-67-0,2.200,,FALSE,,,
5ET12484,Coffee Oil Roasted 10% in DPG from PerfumersWorld,"8001-67-0|0.1
25265-71-8|0.9",0.210,,TRUE,Coffee Oil Roasted from PerfumersWorld,Dipropylene Glycol (DPG) from PerfumersWorld,10.00%
6FY18955,COGNAC F-TEC from PerfumersWorld,mixture,0.200,,FALSE,,,
6FY08507,Cognac Wine Fleuressence from PerfumersWorld,mixture,0.200,,FALSE,,,
6CL18897,COLOGNE F-TEC from PerfumersWorld,mixture,0.190,,FALSE,,,
6CL10405,Cologne Fleuressence from PerfumersWorld,mixture,0.240,,FALSE,,,
3KK00124,Coniferan from PerfumersWorld,67801-20-1,0.450,,FALSE,,,
7SL00125,Coriander Essential Oil from PerfumersWorld,8008-52-4,0.900,,FALSE,,,
5SL08473,Coriander Essential Oil 10% in DPG from PerfumersWorld,"8008-52-4|0.1
25265-71-8|0.9",0.240,,TRUE,Coriander Essential Oil from PerfumersWorld,Dipropylene Glycol (DPG) from PerfumersWorld,10.00%
7BB00832,Cornmint Essential Oil China from PerfumersWorld,68917-18-0,0.270,,FALSE,,,
4XU10872,Cosmone from PerfumersWorld,959193-45-0,4.300,,FALSE,,,
5UW08963,Costus Olifac 1% in DPG from PerfumersWorld,"8023-88-9|0.01
25265-71-8|0.99",0.120,,TRUE,Costus Olifac Iff from PerfumersWorld,Dipropylene Glycol (DPG) from PerfumersWorld,1.00%
5UW11312,Costus Olifac 10% in DPG from PerfumersWorld,"8023-88-9|0.1
25265-71-8|0.9",0.740,,TRUE,Costus Olifac Iff from PerfumersWorld,Dipropylene Glycol (DPG) from PerfumersWorld,10.00%
4UW09665,Costus Olifac Iff from PerfumersWorld,8023-88-9,7.200,,FALSE,,,
1VD00129,Coumarin from PerfumersWorld,91-64-5,0.110,,FALSE,,,
5VD07557,Coumarin 10% in DPG from PerfumersWorld,"91-64-5|0.1
25265-71-8|0.9",0.050,,TRUE,Coumarin from PerfumersWorld,Dipropylene Glycol (DPG) from PerfumersWorld,10.00%
6GB18224,CUCUMBER F-TEC from PerfumersWorld,mixture,0.200,,FALSE,,,
6GF07657,Cucumber Fleuressence from PerfumersWorld,mixture,0.200,,FALSE,,,
7SU00130,Cumin Seed Essential Oil from PerfumersWorld,8014-13-9,1.100,,FALSE,,,
5SU07604,Cumin Seed Essential Oil 1% in DPG from PerfumersWorld,"8014-13-9|0.01
25265-71-8|0.99",0.050,,TRUE,Cumin Seed Essential Oil from PerfumersWorld,Dipropylene Glycol (DPG) from PerfumersWorld,1.00%
5SU19106,Cumin Seed Essential Oil 1% in TEC from PerfumersWorld,"8014-13-9|0.01
77-93-0|0.99",0.080,,TRUE,Cumin Seed Essential Oil from PerfumersWorld,Triethyl Citrate (TEC) from PerfumersWorld,1.00%
5SU18711,Cumin Seed Essential Oil 10% in TEC from PerfumersWorld,"8014-13-9|0.1
77-93-0|0.9",0.150,,TRUE,Cumin Seed Essential Oil from PerfumersWorld,Triethyl Citrate (TEC) from PerfumersWorld,10.00%
3MG00134,Cyclamen Aldehyde from PerfumersWorld,103-95-7,0.340,,FALSE,,,
6ML18413,CYCLAMEN F-TEC from PerfumersWorld,mixture,0.180,,FALSE,,,
6MG09430,Cyclamen Fleuressence from PerfumersWorld,mixture,0.190,,FALSE,,,
4PQ00352,Cymene Para from PerfumersWorld,99-87-6,0.140,,FALSE,,,
8KB00542,Cypress Absolute from PerfumersWorld,8013-86-3,1.870,,FALSE,,,
7KB00833,Cypress Essential Oil from PerfumersWorld,8013-86-3,0.980,,FALSE,,,
6DF18006,D-DAIRY F-TEC from PerfumersWorld,mixture,0.120,,FALSE,,,
6DD08537,D-Dairy Fleuressence from PerfumersWorld,mixture,0.200,,FALSE,,,
3CQ00276,D-Limonene from PerfumersWorld,5989-27-5,0.080,,FALSE,,,
9IF07120,Damascenone from PerfumersWorld,23696-85-7,2.720,,FALSE,,,
3IL00139,Damascol from PerfumersWorld,57378-68-4,0.660,,FALSE,,,
7HH00895,Davana Essential Oil from PerfumersWorld,8016-03-03,4.700,,FALSE,,,
5HH12466,Davana Essential Oil 10% in DPG from PerfumersWorld,"8016-03-3|0.1
25265-71-8|0.9",0.520,,TRUE,Davana Essential Oil from PerfumersWorld,Dipropylene Glycol (DPG) from PerfumersWorld,10.00%
3AC00014,Decanol (Alcohol C-10) from PerfumersWorld,112-30-1,0.120,,FALSE,,,
4CF19148,Decatone from PerfumersWorld,22457-35-6,2.820,,FALSE,,,
4DD03683,Delta Decalactone from PerfumersWorld,705-86-2,0.730,,FALSE,,,
5DD12463,Delta Decalactone 10% in DPG from PerfumersWorld,"705-86-2|0.1
25265-71-8|0.9",0.120,,TRUE,Delta Decalactone from PerfumersWorld,Dipropylene Glycol (DPG) from PerfumersWorld,10.00%
6FL18169,DEWBERRY F-TEC from PerfumersWorld,mixture,0.120,,FALSE,,,
6FL09127,Dewberry Fleuressence from PerfumersWorld,mixture,0.210,,FALSE,,,
9DV00144,Diacetyl from PerfumersWorld,0431-03-08,0.210,,FALSE,,,
5DV07644,Diacetyl 1% in DPG from PerfumersWorld,"431-03-8|0.01
25265-71-8|0.99",0.080,,TRUE,Diacetyl from PerfumersWorld,Dipropylene Glycol (DPG) from PerfumersWorld,1.00%
3FG00145,Diethyl Malonate from PerfumersWorld,105-53-3,0.090,,FALSE,,,
0ZX00143,Diethyl Phthalate (DEP) from PerfumersWorld,84-66-2,0.080,,FALSE,,,
3IL00153,Dihydro Beta Ionone from PerfumersWorld,17283-81-7,0.600,,FALSE,,,
4HF00147,Dihydro Carvyl Acetate from PerfumersWorld,20777-49-5,2.500,,FALSE,,,
2VD00148,Dihydro Coumarin from PerfumersWorld,119-84-6,0.160,,FALSE,,,
4JN00149,Dihydro Jasmone from PerfumersWorld,1128-08-01,0.900,,FALSE,,,
5JN10948,Dihydro Jasmone 10% in DPG from PerfumersWorld,"1128-08-1|0.1
25265-71-8|0.9",0.120,,TRUE,Dihydro Jasmone from PerfumersWorld,Dipropylene Glycol (DPG) from PerfumersWorld,10.00%
3CK00150,Dihydro Myrcenol from PerfumersWorld,18479-58-8,0.120,,FALSE,,,
3KL00152,Dihydro Terpinyl Acetate from PerfumersWorld,80-25-1,0.300,,FALSE,,,
7HH07671,Dill Essential Oil from PerfumersWorld,8006-75-5,0.670,,FALSE,,,
3NC00155,Dimethyl Anthranilate from PerfumersWorld,85-91-6,0.330,,FALSE,,,
3LL00156,Dimethyl Benzyl Carbinol from PerfumersWorld,100-86-7,0.270,,FALSE,,,
3LF00157,Dimethyl Benzyl Carbinyl Acetate from PerfumersWorld,0151-05-03,0.170,,FALSE,,,
4LD02865,Dimethyl Benzyl Carbinyl Butyrate from PerfumersWorld,10094-34-5,0.140,,FALSE,,,
5EG09234,Dimethyl Sulfide 1% in DPG from PerfumersWorld,"75-18-3|0.01
25265-71-8|0.99",0.100,,FALSE,,,1.00%
3CK07504,Dimetol from PerfumersWorld,13254-34-7,0.360,,FALSE,,,
2RB00163,Diphenyl Oxide from PerfumersWorld,101-84-8,0.080,,FALSE,,,
5RB09235,Diphenyl Oxide 10% in DPG from PerfumersWorld,"101-84-8|0.1
25265-71-8|0.9",0.060,,TRUE,Diphenyl Oxide from PerfumersWorld,Dipropylene Glycol (DPG) from PerfumersWorld,10.00%
5RB07855,Diphenyl Oxide 50% in DPG from PerfumersWorld,"101-84-8|0.5
25265-71-8|0.5",0.070,,TRUE,Diphenyl Oxide from PerfumersWorld,Dipropylene Glycol (DPG) from PerfumersWorld,50.00%
0ZW00165,Dipropylene Glycol (DPG) from PerfumersWorld,25265-71-8,0.070,,FALSE,,,
3AC03955,Dodecyl Nitrile from PerfumersWorld,2437-25-4,0.460,,FALSE,,,
5AC07788,Dodecyl Nitrile 10% in DPG from PerfumersWorld,"2437-25-4|0.1
25265-71-8|0.9",0.090,,TRUE,Dodecyl Nitrile from PerfumersWorld,Dipropylene Glycol (DPG) from PerfumersWorld,10.00%
4MA00167,Dupical from PerfumersWorld,30168-23-1,1.820,,FALSE,,,
5MA08874,Dupical 10% in DPG from PerfumersWorld,"30168-23-1|0.1
25265-71-8|0.9",0.260,,TRUE,Dupical from PerfumersWorld,Dipropylene Glycol (DPG) from PerfumersWorld,10.00%
4FG07161,Dynascone from PerfumersWorld,56973-85-4,2.400,,FALSE,,,
5FG22457,Dynascone 10% in DPG from PerfumersWorld,"56973-85-4|0.1
25265-71-8|0.9",0.270,,TRUE,Dynascone from PerfumersWorld,Dipropylene Glycol (DPG) from PerfumersWorld,10.00%
6EG18010,E-EDIBLE F-TEC from PerfumersWorld,mixture,0.120,,FALSE,,,
6EG08432,E-Edible Fleuressence from PerfumersWorld,mixture,0.200,,FALSE,,,
4WX07563,Ebanol from PerfumersWorld,67801-20-1,0.760,,FALSE,,,
7QC00902,Elemi Essential Oil from PerfumersWorld,8023-89-0,0.440,,FALSE,,,
2CQ00168,Elemi Gum from PerfumersWorld,9000-75-3,0.270,,FALSE,,,
7PH00170,Estragon Oil from PerfumersWorld,8016-88-4,1.300,,FALSE,,,
4FD04118,Ethyl 2-Methylbutyrate from PerfumersWorld,7452-79-1,0.360,,FALSE,,,
5FD12135,Ethyl 2-Methylbutyrate 10% in DPG from PerfumersWorld,"7452-79-1|0.1
25265-71-8|0.9",0.070,,TRUE,Ethyl 2-Methylbutyrate from PerfumersWorld,Dipropylene Glycol (DPG) from PerfumersWorld,10.00%
9FC01313,Ethyl Acetate from PerfumersWorld,141-78-6,0.050,,FALSE,,,
5FC12427,Ethyl Acetate 10% in DPG from PerfumersWorld,"141-78-6|0.1
25265-71-8|0.9",0.030,,TRUE,Ethyl Acetate from PerfumersWorld,Dipropylene Glycol (DPG) from PerfumersWorld,10.00%
3FG00172,Ethyl Acetoacetate from PerfumersWorld,141-97-9,0.080,,FALSE,,,
4FY00173,Ethyl Amyl Ketone from PerfumersWorld,106-68-3,1.100,,FALSE,,,
3NF03984,Ethyl Anthranilate from PerfumersWorld,87-25-2,0.370,,FALSE,,,
3NJ01315,Ethyl Benzoate from PerfumersWorld,93-89-0,0.130,,FALSE,,,
5NJ12470,Ethyl Benzoate 10% in DPG from PerfumersWorld,"93-89-0|0.1
25265-71-8|0.9",0.050,,TRUE,Ethyl Benzoate from PerfumersWorld,Dipropylene Glycol (DPG) from PerfumersWorld,10.00%
3FD00174,Ethyl Butyrate from PerfumersWorld,105-54-4,0.080,,FALSE,,,
4FD02026,Ethyl Isovalerate from PerfumersWorld,108-64-5,0.090,,FALSE,,,
3FD04102,Ethyl Lactate from PerfumersWorld,97-64-3,0.090,,FALSE,,,
3FH04104,Ethyl Levulinate from PerfumersWorld,539-88-8,0.220,,FALSE,,,
4LL11499,Ethyl Linalool from PerfumersWorld,10339-55-6,0.190,,FALSE,,,
3LC19147,Ethyl Linalyl Acetate from PerfumersWorld,61931-80-4,0.280,,FALSE,,,
1VF00175,Ethyl Maltol from PerfumersWorld,4940-11-8,0.480,,FALSE,,,
5VF07861,Ethyl Maltol 1% in DPG from PerfumersWorld,"4940-11-8|0.01
25265-71-8|0.99",0.040,,TRUE,Ethyl Maltol from PerfumersWorld,Dipropylene Glycol (DPG) from PerfumersWorld,1.00%
5VF07531,Ethyl Maltol 5% in DPG from PerfumersWorld,"4940-11-8|0.05
25265-71-8|0.95",0.090,,TRUE,Ethyl Maltol from PerfumersWorld,Dipropylene Glycol (DPG) from PerfumersWorld,5.00%
3PF02759,Ethyl Phenyl Acetate from PerfumersWorld,101-97-3,0.200,,FALSE,,,
5PF07867,Ethyl Phenyl Acetate 10% in DPG from PerfumersWorld,"101-97-3|0.1
25265-71-8|0.9",0.070,,TRUE,Ethyl Phenyl Acetate from PerfumersWorld,Dipropylene Glycol (DPG) from PerfumersWorld,10.00%
4ES06848,Ethyl Safranate from PerfumersWorld,35044-59-8,1.570,,FALSE,,,
5ES13018,Ethyl Safranate 10% in DPG from PerfumersWorld,"35044-59-8|0.1
25265-71-8|0.9",0.200,,TRUE,Ethyl Safranate from PerfumersWorld,Dipropylene Glycol (DPG) from PerfumersWorld,10.00%
3OP01253,Ethyl Salicylate from PerfumersWorld,118-61-6,0.450,,FALSE,,,
5OP12472,Ethyl Salicylate 10% in DPG from PerfumersWorld,"118-61-6|0.1
25265-71-8|0.9",0.060,,TRUE,Ethyl Salicylate from PerfumersWorld,Dipropylene Glycol (DPG) from PerfumersWorld,10.00%
1VV00179,Ethyl Vanillin from PerfumersWorld,121-32-4,0.300,,FALSE,,,
5VV07559,Ethyl Vanillin 10% in DPG from PerfumersWorld,"121-32-4|0.1
25265-71-8|0.9",0.070,,TRUE,Ethyl Vanillin from PerfumersWorld,Dipropylene Glycol (DPG) from PerfumersWorld,10.00%
3XU00180,Ethylene Brassylate from PerfumersWorld,105-95-3,0.290,,FALSE,,,
3BH00181,Eucalyptol from PerfumersWorld,470-82-6,0.210,,FALSE,,,
7CC00914,Eucalyptus Citriodora Essential Oil from PerfumersWorld,8000-48-4,0.250,,FALSE,,,
6CA07765,Eucalyptus Citriodora Natural Blend from PerfumersWorld,mixture,0.250,,FALSE,,,
7BH00182,Eucalyptus Globulus Essential Oil from PerfumersWorld,8000-48-4,0.170,,FALSE,,,
3SP00184,Eugenol from PerfumersWorld,97-53-0,0.200,,FALSE,,,
0ZA01393,Evening Primrose Oil - Fixed Oil from PerfumersWorld,90028-66-3,0.250,,FALSE,,,
1YP00185,Evernyl from PerfumersWorld,4707-47-5,0.520,,FALSE,,,
5YY07815,Evernyl 10% in DPG from PerfumersWorld,"4707-47-5|0.1
25265-71-8|0.9",0.090,,TRUE,Evernyl from PerfumersWorld,Dipropylene Glycol (DPG) from PerfumersWorld,10.00%
2XX00186,Exaltolide Pentadecanolide from PerfumersWorld,0106-02-05,1.100,,FALSE,,,
5XX07862,Exaltolide Pentadecanolide 10% in DPG from PerfumersWorld,"106-02-5|0.1
25265-71-8|0.9",0.150,,TRUE,Exaltolide Pentadecanolide from PerfumersWorld,Dipropylene Glycol (DPG) from PerfumersWorld,10.00%
5XX08283,Exaltolide Pentadecanolide 50% in DPG from PerfumersWorld,"106-02-5|0.5
25265-71-8|0.5",0.840,,TRUE,Exaltolide Pentadecanolide from PerfumersWorld,Dipropylene Glycol (DPG) from PerfumersWorld,50.00%
6FD10042,F-Fruit Fleuressence from PerfumersWorld,mixture,0.200,,FALSE,,,
6FD18011,F-FRUITY F-TEC from PerfumersWorld,mixture,0.120,,FALSE,,,
3LW00187,Farnesol from PerfumersWorld,4602-84-0,1.100,,FALSE,,,
7SB00189,Fennel Sweet Essential Oil from PerfumersWorld,8006-84-6,0.790,,FALSE,,,
7KG07758,Fir Essential Oil from PerfumersWorld,8021-28-1,0.700,,FALSE,,,
3XU22434,Fixamber from PerfumersWorld,71735-79-0,0.500,,FALSE,,,
4UY07514,Fixative 505 from PerfumersWorld,mixture,2.300,,FALSE,,,
5UY10543,Fixative 505 1% in DPG from PerfumersWorld,mixture,0.100,,TRUE,Fixative 505 from PerfumersWorld,Dipropylene Glycol (DPG) from PerfumersWorld,1.00%
5UY07860,Fixative 505 10% in DPG from PerfumersWorld,mixture,0.260,,TRUE,Fixative 505 from PerfumersWorld,Dipropylene Glycol (DPG) from PerfumersWorld,10.00%
3MX07491,Fixetal from PerfumersWorld,3087-36-3,0.160,,FALSE,,,
6ML12398,Fleurissimo Blender Fleuressence from PerfumersWorld,mixture,0.180,,FALSE,,,
6ML18412,FLEURISSIMO F-TEC from PerfumersWorld,mixture,0.170,,FALSE,,,
4YM00191,Floralozone from PerfumersWorld,67634-15-5,0.220,,FALSE,,,
3ML00192,Florol from PerfumersWorld,63500-71-0,0.100,,FALSE,,,
6JV18248,FLOWER BOUQUET F-TEC from PerfumersWorld,mixture,0.160,,FALSE,,,
6JV10408,Flower Bouquet Fleuressence from PerfumersWorld,mixture,0.200,,FALSE,,,
6YG18317,FOUGERE VERT F-TEC from PerfumersWorld,mixture,0.220,,FALSE,,,
6YG10384,Fougere Vert Fleuressence from PerfumersWorld,mixture,0.210,,FALSE,,,
6EJ18929,FRAGRANT RICE F-TEC from PerfumersWorld,mixture,0.120,,FALSE,,,
6EJ20524,Fragrant Rice Fleuressence from PerfumersWorld,mixture,0.200,,FALSE,,,
8ON00534,Frangipani Absolute from PerfumersWorld,92457-20-0,13.020,,FALSE,,,
5ON09236,Frangipani Absolute 10% in DPG from PerfumersWorld,"92457-20-0|0.1
25265-71-8|0.9",2.020,,TRUE,Frangipani Absolute from PerfumersWorld,Dipropylene Glycol (DPG) from PerfumersWorld,10.00%
6ON18794,FRANGIPANI F-TEC from PerfumersWorld,mixture,0.170,,FALSE,,,
6ON09090,Frangipani Fleuressence from PerfumersWorld,mixture,0.190,,FALSE,,,
6QK19340,FRANKINCENSE F-TEC from PerfumersWorld,mixture,0.450,,FALSE,,,
6QC09083,Frankincense Fleuressence from PerfumersWorld,mixture,0.460,,FALSE,,,
6LF18321,FREESIA F-TEC from PerfumersWorld,mixture,0.150,,FALSE,,,
6LF09041,Freesia Fleuressence from PerfumersWorld,mixture,0.140,,FALSE,,,
6LC07501,Freesia HDL from PerfumersWorld,mixture,0.140,,FALSE,,,
6FB07709,Fresh Blackcurrant Leaf from PerfumersWorld,mixture,0.620,,FALSE,,,
6LF18323,FRESH BLENDER F-TEC from PerfumersWorld,mixture,0.120,,FALSE,,,
6LF09429,Fresh Blender Fleuressence from PerfumersWorld,mixture,0.320,,FALSE,,,
3FG00196,Fructone B from PerfumersWorld,6413-10-1,0.140,,FALSE,,,
6IF18246,FRUITY IONONE F-TEC from PerfumersWorld,mixture,0.180,,FALSE,,,
6JF09428,Fruity Jasmine Fleuressence from PerfumersWorld,mixture,0.200,,FALSE,,,
5VE09272,Furaneol 10% in PG from PerfumersWorld,"3658-77-3|0.1
57-55-6|0.9",0.200,,FALSE,,,10.00%
6GG18012,G-GREEN F-TEC from PerfumersWorld,mixture,0.180,,FALSE,,,
6GG07716,G-Green Fleuressence from PerfumersWorld,mixture,0.200,,FALSE,,,
7SH00198,Galanga Root Essential Oil from PerfumersWorld,8024-06-04,2.500,,FALSE,,,
4XA13770,Galaxolide 100 (Undiluted) from PerfumersWorld,1222-05-05,0.150,,FALSE,,,
3XA00199,Galaxolide 50 DEP from PerfumersWorld,"1222-05-5|0.5
84-66-2|0.5",0.100,,FALSE,,,
3XA10721,Galaxolide 50 DPG from PerfumersWorld,"1222-05-5|0.5
25265-71-8|0.5",0.100,,FALSE,,,
7GQ00200,Galbanum Essential Oil from PerfumersWorld,8023-91-4,2.400,,FALSE,,,
7GQ10557,Galbanum Essential Oil 10% in DPG from PerfumersWorld,"8023-91-4|0.1
25265-71-8|0.9",0.300,,TRUE,Galbanum Essential Oil from PerfumersWorld,Dipropylene Glycol (DPG) from PerfumersWorld,10.00%
6GQ18226,GALBANUM F-TEC from PerfumersWorld,mixture,0.500,,FALSE,,,
6GQ09095,Galbanum Fleuressence from PerfumersWorld,mixture,0.450,,FALSE,,,
3GF19243,Galbex183 from PerfumersWorld,68901-15-5,1.000,,FALSE,,,
4DD01639,Gamma Decalactone from PerfumersWorld,706-14-9,0.120,,FALSE,,,
5DD07874,Gamma Decalactone 10% in DPG from PerfumersWorld,"706-14-9|0.1
25265-71-8|0.9",0.110,,TRUE,Gamma Decalactone from PerfumersWorld,Dipropylene Glycol (DPG) from PerfumersWorld,10.00%
4DF00164,Gamma Dodecalactone from PerfumersWorld,2305-05-07,0.800,,FALSE,,,
