Product_ID,Material_Name,CAS_Number,Price_US/g,Notes,Is_Dilution,Active_Material,Solvent,Active_%
4DD00331,Gamma Octalactone from PerfumersWorld,104-50-7,0.470,,FALSE,,,
5DV08651,Gamma Octalactone 10% in DPG from PerfumersWorld,"104-50-7|0.1
25265-71-8|0.9",0.080,,TRUE,Gamma Octalactone from PerfumersWorld,Dipropylene Glycol (DPG) from PerfumersWorld,10.00%
6ND18759,GARDENIA F-TEC from PerfumersWorld,mixture,0.180,,FALSE,,,
6ND09094,Gardenia Fleuressence from PerfumersWorld,mixture,0.200,,FALSE,,,
5YW13682,Geosmin 1% in DPG from PerfumersWorld,"19700-21-1|0.01
25265-71-8|0.99",1.390,,FALSE,,,1.00%
5YW18061,Geosmin 1% in TEC from PerfumersWorld,"19700-21-1|0.01
77-93-0|0.99",1.420,,FALSE,,,1.00%
3RL00204,Geraniol from PerfumersWorld,106-24-1,0.120,,FALSE,,,
7RB00930,Geranium Bourbon Essential Oil from PerfumersWorld,8000-46-2,1.380,,FALSE,,,
7RB00205,Geranium Essential Oil from PerfumersWorld,8000-46-2,0.620,,FALSE,,,
6RB18440,GERANIUM F-TEC from PerfumersWorld,mixture,0.300,,FALSE,,,
6RB07924,Geranium Fleuressence from PerfumersWorld,mixture,0.280,,FALSE,,,
3RL00206,Geranyl Acetate from PerfumersWorld,105-87-3,0.200,,FALSE,,,
4RD00207,Geranyl Butyrate from PerfumersWorld,106-29-6,0.810,,FALSE,,,
4RW00208,Geranyl Formate from PerfumersWorld,105-86-2,0.300,,FALSE,,,
3RP04262,Geranyl Phenylacetate from PerfumersWorld,102-22-7,1.900,,FALSE,,,
7SC00209,Ginger Essential Oil from PerfumersWorld,8007-08-07,0.520,,FALSE,,,
6SC18559,GINGER F-TEC from PerfumersWorld,mixture,0.180,,FALSE,,,
6SC12414,Ginger Fleuressence from PerfumersWorld,mixture,0.300,,FALSE,,,
4RF06840,Givescone from PerfumersWorld,57934-97-1,1.570,,FALSE,,,
3MW11714,Glycolierral from PerfumersWorld,68901-15-5,0.590,,FALSE,,,
6VF18896,GOURMANDE F-TEC from PerfumersWorld,mixture,0.160,,FALSE,,,
6VF12416,Gourmande Fleuressence from PerfumersWorld,mixture,0.220,,FALSE,,,
6FN18883,GRAPE F-TEC from PerfumersWorld,mixture,0.180,,FALSE,,,
6FN09097,Grape Fleuressence from PerfumersWorld,mixture,0.140,,FALSE,,,
6CA18126,GRAPEFRUIT F-TEC from PerfumersWorld,mixture,0.200,,FALSE,,,
7CA24030,Grapefruit FCF oil Sicilian from PerfumersWorld,8016-20-4,0.180,,FALSE,,,
6CN12394,Grapefruit Fleuressence from PerfumersWorld,mixture,0.250,,FALSE,,,
7CN00210,Grapefruit Pink Essential Oil from PerfumersWorld,8016-20-4,0.390,,FALSE,,,
7CA00868,Grapefruit White Essential Oil from PerfumersWorld,8016-20-4,0.680,,FALSE,,,
7CA24033,Grapefruit White oil Sicilian from PerfumersWorld,8016-20-4,0.200,,FALSE,,,
0ZA01434,Grapeseed Oil - Fixed Oil from PerfumersWorld,8024-22-4,0.090,,FALSE,,,
6AG18116,GREEN ALDEHYDE F-TEC from PerfumersWorld,mixture,0.160,,FALSE,,,
6AG09015,Green Aldehyde Fleuressence from PerfumersWorld,mixture,0.240,,FALSE,,,
8KG23405,Green pine absolute from PerfumersWorld,8021-29-2,2.200,,FALSE,,,
5KG23683,Green pine absolute 10% in DPG from PerfumersWorld,"8021-29-2|0.1
25265-71-8|0.9",0.250,,TRUE,Green pine absolute from PerfumersWorld,Dipropylene Glycol (DPG) from PerfumersWorld,10.00%
6KG18320,GREEN PINE F-TEC from PerfumersWorld,mixture,0.190,,FALSE,,,
6KG08506,Green Pine Fleuressence from PerfumersWorld,mixture,0.200,,FALSE,,,
6EG18166,GREEN TEA F-TEC from PerfumersWorld,mixture,0.250,,FALSE,,,
6EG12402,Green Tea Fleuressence from PerfumersWorld,mixture,0.250,,FALSE,,,
9PT00213,Guaiacol from PerfumersWorld,90-05-1,0.190,,FALSE,,,
5PT18969,Guaiacol 1% in TEC from PerfumersWorld,"90-05-1|0.01
77-93-0|0.99",0.050,,TRUE,Guaiacol from PerfumersWorld,Triethyl Citrate (TEC) from PerfumersWorld,1.00%
5PT07645,Guaiacol 10% in DPG from PerfumersWorld,"90-05-1|0.1
25265-71-8|0.9",0.100,,TRUE,Guaiacol from PerfumersWorld,Dipropylene Glycol (DPG) from PerfumersWorld,10.00%
7RW00214,Guaiacwood Essential Oil from PerfumersWorld,8016-23-7,0.250,,FALSE,,,
5RW08677,Guaiacwood Essential Oil 10% in DPG from PerfumersWorld,"8016-23-7|0.1
25265-71-8|0.9",0.120,,TRUE,Guaiacwood Essential Oil from PerfumersWorld,Dipropylene Glycol (DPG) from PerfumersWorld,10.00%
5RW07565,Guaiacwood Essential Oil 50% in DPG from PerfumersWorld,"8016-23-7|0.5
25265-71-8|0.5",0.160,,TRUE,Guaiacwood Essential Oil from PerfumersWorld,Dipropylene Glycol (DPG) from PerfumersWorld,50.00%
3RW04286,Guaiyl Acetate from PerfumersWorld,134-28-1,0.800,,FALSE,,,
7WS13096,Guava Leaf Essential Oil from PerfumersWorld,8000-30-4,1.300,,FALSE,,,
6HL18013,H-HERB F-TEC from PerfumersWorld,mixture,0.260,,FALSE,,,
6HL11969,H-Herb Fleuressence from PerfumersWorld,mixture,0.290,,FALSE,,,
3XA09821,Habanolide from PerfumersWorld,111879-80-2,0.450,,FALSE,,,
8NY00523,Hay Absolute from PerfumersWorld,8031-00-3,4.400,,FALSE,,,
5NY12745,Hay Absolute 10% in DPG from PerfumersWorld,"8031-00-3|0.1
25265-71-8|0.9",0.410,,TRUE,Hay Absolute from PerfumersWorld,Dipropylene Glycol (DPG) from PerfumersWorld,10.00%
3JJ00218,Hedione from PerfumersWorld,24851-98-7,0.150,,FALSE,,,
4JJ10013,Hedione High Cis from PerfumersWorld,24851-98-7,1.000,,FALSE,,,
3GM00219,Helional from PerfumersWorld,1205-17-0,0.290,,FALSE,,,
6VN21924,HELIOTROPAL from PerfumersWorld,mixture,0.390,,FALSE,,,
6VN21659,Heliotrope Base - Heliotropin Replacement from PerfumersWorld,mixture,0.500,,FALSE,,,
6VN18501,HELIOTROPE F-TEC from PerfumersWorld,mixture,0.250,,FALSE,,,
6VN09081,Heliotrope Fleuressence from PerfumersWorld,mixture,0.200,,FALSE,,,
3XD17215,Helvetolide from PerfumersWorld,417985-88-7,1.900,,FALSE,,,
2QZ00223,Hercolyn D from PerfumersWorld,8050-15-5,0.100,,FALSE,,,
4DH02050,Hexanlactone-gamma from PerfumersWorld,0695-06-07,0.720,,FALSE,,,
4FG13385,Hexanoic Acid from PerfumersWorld,142-62-1,0.100,,FALSE,,,
4FG04398,Hexanol from PerfumersWorld,111-27-3,0.200,,FALSE,,,
4FG01284,Hexyl Acetate from PerfumersWorld,142-92-7,0.120,,FALSE,,,
3JJ00217,Hexyl Cinnamic Aldehyde (HCA) from PerfumersWorld,101-86-0,0.100,,FALSE,,,
3OG00230,Hexyl Salicylate from PerfumersWorld,6259-76-3,0.090,,FALSE,,,
7LB07762,Ho Essential Oil from PerfumersWorld,8022-91-1,0.290,,FALSE,,,
7HS08359,Holy Basil Essential Oil from PerfumersWorld,91845-35-1,0.840,,FALSE,,,
6PF18597,HONEY F-TEC from PerfumersWorld,mixture,0.150,,FALSE,,,
6PF08147,Honey Fleuressence from PerfumersWorld,mixture,0.200,,FALSE,,,
4GN00231,Hyacinth Body from PerfumersWorld,mixture,0.600,,FALSE,,,
5GN08474,Hyacinth Body 10% in DPG from PerfumersWorld,mixture,0.110,,TRUE,Hyacinth Body from PerfumersWorld,Dipropylene Glycol (DPG) from PerfumersWorld,10.00%
6GN18227,HYACINTH F-TEC from PerfumersWorld,mixture,0.250,,FALSE,,,
6GN09131,Hyacinth Fleuressence from PerfumersWorld,mixture,0.220,,FALSE,,,
4GM00232,Hydratropic Aldehyde from PerfumersWorld,93-53-8,0.300,,FALSE,,,
3MC00233,Hydroxycitronellal from PerfumersWorld,107-75-5,0.230,,FALSE,,,
7HS00870,Hyssop Essential Oil from PerfumersWorld,8006-83-5,1.770,,FALSE,,,
6IA18014,I-IRIS F-TEC from PerfumersWorld,mixture,0.180,,FALSE,,,
6IA09182,I-Iris Fleuressence from PerfumersWorld,mixture,0.200,,FALSE,,,
8NY23449,Immortelle Absolute from PerfumersWorld,8023-95-8,4.800,,FALSE,,,
5NY23688,Immortelle Absolute 10% in DPG from PerfumersWorld,"8023-95-8|0.1
25265-71-8|0.9",0.520,,TRUE,Immortelle Absolute from PerfumersWorld,Dipropylene Glycol (DPG) from PerfumersWorld,10.00%
3WX10767,Indisan from PerfumersWorld,5463-39-8,0.120,,FALSE,,,
6UN22430,Indocolore from PerfumersWorld,23787-90-8,1.600,,FALSE,,,
6UN22737,Indofleur ND from PerfumersWorld,mixture,0.200,,FALSE,,,
9UN00235,Indole from PerfumersWorld,120-72-9,0.360,,FALSE,,,
5UN07558,Indole 10% in DPG from PerfumersWorld,"120-72-9|0.1
25265-71-8|0.9",0.100,,TRUE,Indole from PerfumersWorld,Dipropylene Glycol (DPG) from PerfumersWorld,10.00%
4NU04558,Indolene from PerfumersWorld,67860-00-8,0.520,,FALSE,,,
5NU07552,Indolene 10% in DPG from PerfumersWorld,"67860-00-8|0.1
25265-71-8|0.9",0.080,,TRUE,Indolene from PerfumersWorld,Dipropylene Glycol (DPG) from PerfumersWorld,10.00%
6NU23529,Indolene ND Replacer from PerfumersWorld,mixture,0.130,,FALSE,,,
6IF08388,Ionone Fruity Fleuressence from PerfumersWorld,mixture,0.210,,FALSE,,,
3IA06874,Irotyl from PerfumersWorld,1335-46-2,0.260,,FALSE,,,
3WY00244,Iso E Super from PerfumersWorld,54464-57-2,0.120,,FALSE,,,
9FD00245,Isoamyl Acetate from PerfumersWorld,123-92-2,0.100,,FALSE,,,
3FD00246,Isoamyl Butyrate from PerfumersWorld,106-27-4,0.090,,FALSE,,,
3KH00065,Isobornyl Acetate from PerfumersWorld,0125-12-2,0.120,,FALSE,,,
4VV16856,Isobutavan from PerfumersWorld,20665-85-4,0.460,,FALSE,,,
9UP00247,Isobutyl Quinoline from PerfumersWorld,65442-31-1,1.800,,FALSE,,,
5UP07523,Isobutyl Quinoline 10% in DPG from PerfumersWorld,"65442-31-1|0.1
25265-71-8|0.9",0.200,,TRUE,Isobutyl Quinoline from PerfumersWorld,Dipropylene Glycol (DPG) from PerfumersWorld,10.00%
4DF13384,Isobutyric Acid from PerfumersWorld,79-31-2,0.440,,FALSE,,,
5DF14120,Isobutyric Acid 10% in DPG from PerfumersWorld,"79-31-2|0.1
25265-71-8|0.9",0.220,,TRUE,Isobutyric Acid from PerfumersWorld,Dipropylene Glycol (DPG) from PerfumersWorld,10.00%
4CA03618,Isocyclocitral from PerfumersWorld,1335-46-2,0.620,,FALSE,,,
3SP00250,Isoeugenol from PerfumersWorld,97-54-1,0.300,,FALSE,,,
3WY14446,Isolongifolanone from PerfumersWorld,23787-90-8,0.420,,FALSE,,,
3LH00252,Isononyl Acetate from PerfumersWorld,58430-94-7,0.120,,FALSE,,,
0ZZ00239,Isopropyl Myristate (IPM) from PerfumersWorld,110-27-0,0.060,,FALSE,,,
0ZZ00240,Isopropyl Palmitate (IPP) from PerfumersWorld,142-91-6,0.110,,FALSE,,,
3GS16129,Ivybase from PerfumersWorld,mixture,0.520,,FALSE,,,
6JN18016,J-JASMIN F-TEC from PerfumersWorld,mixture,0.160,,FALSE,,,
6JN08956,J-Jasmine Fleuressence from PerfumersWorld,mixture,0.200,,FALSE,,,
6JN19189,JASMIN ABS F-TEC from PerfumersWorld,mixture,0.150,,FALSE,,,
6JL18251,JASMIN FRUIT F-TEC from PerfumersWorld,mixture,0.120,,FALSE,,,
3JF07351,Jasmin Lactone from PerfumersWorld,32764-98-0,4.900,,FALSE,,,
8JN00254,Jasmine Absolute from PerfumersWorld,8022-96-6,18.500,,FALSE,,,
5JN08464,Jasmine Absolute 10% in DPG from PerfumersWorld,"8022-96-6|0.1
25265-71-8|0.9",1.900,,TRUE,Jasmine Absolute from PerfumersWorld,Dipropylene Glycol (DPG) from PerfumersWorld,10.00%
5JN09617,Jasmine Absolute 10% in Palm Oil Fractionated from PerfumersWorld,"8022-96-6|0.1
8002-75-3|0.9",1.950,,TRUE,Jasmine Absolute from PerfumersWorld,Jasmine Absolute 10% in Palm Oil Fractionated from PerfumersWorld,10.00%
6JN07720,Jasmine Absolute Fleuressence from PerfumersWorld,mixture,0.260,,FALSE,,,
6JJ18250,JASMINE PETAL F-TEC from PerfumersWorld,mixture,0.120,,FALSE,,,
6JJ09085,Jasmine Petal Fleuressence from PerfumersWorld,mixture,0.200,,FALSE,,,
8JN00256,Jasmine Sambac Absolute from PerfumersWorld,91770-14-8,11.000,,FALSE,,,
5JN08327,Jasmine Sambac Absolute 10% in DPG from PerfumersWorld,"91770-14-8|0.1
25265-71-8|0.9",1.200,,TRUE,Jasmine Sambac Absolute from PerfumersWorld,Dipropylene Glycol (DPG) from PerfumersWorld,10.00%
6JN07707,Jasmine Sambac Blossoms from PerfumersWorld,mixture,0.450,,FALSE,,,
4WX10027,Javanol from PerfumersWorld,198404-98-7,2.160,,FALSE,,,
3JN00258,Jessemal Jasmonyl from PerfumersWorld,18871-14-2,0.200,,FALSE,,,
0ZA01456,Jojoba Oil - Fixed Oil from PerfumersWorld,61789-91-1,0.250,,FALSE,,,
7KH00262,Juniper Berry Essential Oil from PerfumersWorld,8002-68-4,1.980,,FALSE,,,
5KH07869,Juniper Berry Essential Oil 10% in DPG from PerfumersWorld,"8002-68-4|0.1
25265-71-8|0.9",0.220,,TRUE,Juniper Berry Essential Oil from PerfumersWorld,Dipropylene Glycol (DPG) from PerfumersWorld,10.00%
6KL18017,K-KONIFER F-TEC from PerfumersWorld,mixture,0.140,,FALSE,,,
6KL11970,K-Konifer Fleuressence from PerfumersWorld,mixture,0.200,,FALSE,,,
4WU16857,Karanal from PerfumersWorld,117933-89-8,0.870,,FALSE,,,
4WY07089,Kephalis from PerfumersWorld,36306-87-3,0.570,,FALSE,,,
4WI10591,Koavone from PerfumersWorld,74113-74-9,0.180,,FALSE,,,
4BB00088,L-Carvone from PerfumersWorld,6485-40-1,0.220,,FALSE,,,
6LL00487,L-Linalool Fleuressence from PerfumersWorld,mixture,0.200,,FALSE,,,
8UQ08219,Labdanum Absolute from PerfumersWorld,8016-26-0,1.100,,FALSE,,,
5UQ07791,Labdanum Absolute 10% in DPG from PerfumersWorld,"8016-26-0|0.1
25265-71-8|0.9",0.180,,TRUE,Labdanum Absolute from PerfumersWorld,Dipropylene Glycol (DPG) from PerfumersWorld,10.00%
6UH18500,LABDANUM F-TEC from PerfumersWorld,mixture,0.320,,FALSE,,,
6UH09680,Labdanum Fleuressence from PerfumersWorld,mixture,0.320,,FALSE,,,
2UQ00264,Labdanum Resinoid from PerfumersWorld,8016-26-0,0.680,,FALSE,,,
5UQ12486,Labdanum Resinoid 10% in DEP from PerfumersWorld,"8016-26-0|0.1
84-66-2|0.9",0.120,,TRUE,Labdanum Resinoid from PerfumersWorld,Diethyl Phthalate (DEP) from PerfumersWorld,10.00%
5UQ07566,Labdanum Resinoid 10% in DPG from PerfumersWorld,"8016-26-0|0.1
25265-71-8|0.9",0.120,,TRUE,Labdanum Resinoid from PerfumersWorld,Dipropylene Glycol (DPG) from PerfumersWorld,10.00%
6DD18141,LACTONE F-TEC from PerfumersWorld,mixture,0.120,,FALSE,,,
6DD08390,Lactone Fleuressence from PerfumersWorld,mixture,0.140,,FALSE,,,
1AA06214,Lauric Acid from PerfumersWorld,0143-07-07,0.090,,FALSE,,,
5AA12488,Lauric Acid 10% in DPG from PerfumersWorld,"143-07-7|0.1
25265-71-8|0.9",0.060,,TRUE,Lauric Acid from PerfumersWorld,Dipropylene Glycol (DPG) from PerfumersWorld,10.00%
8HY00554,Lavandin Absolute from PerfumersWorld,91722-69-9,1.600,,FALSE,,,
7HB00265,Lavandin Essential Oil from PerfumersWorld,8022-15-9,0.240,,FALSE,,,
7HB07675,Lavandin Grosso Essential Oil from PerfumersWorld,8022-15-9,0.460,,FALSE,,,
7HB08129,Lavandin Super from PerfumersWorld,8022-15-9,0.200,,FALSE,,,
4HW03807,Lavender Aldehyde from PerfumersWorld,67633-96-9,0.800,,FALSE,,,
5HW23697,Lavender Aldehyde 10% in DPG from PerfumersWorld,"67633-96-9|0.1
25265-71-8|0.9",0.150,,TRUE,Lavender Aldehyde from PerfumersWorld,Dipropylene Glycol (DPG) from PerfumersWorld,10.00%
7HL00267,Lavender Essential Oil from PerfumersWorld,8000-28-0,0.370,,FALSE,,,
6HL18238,LAVENDER F-TEC from PerfumersWorld,mixture,0.280,,FALSE,,,
6HL09061,Lavender Fleuressence from PerfumersWorld,mixture,0.300,,FALSE,,,
8HY09000,Lavender Green Absolute from PerfumersWorld,8000-28-0,1.860,,FALSE,,,
7HB00269,Lavender Spike Essential Oil from PerfumersWorld,8016-78-2,0.450,,FALSE,,,
4GI15439,Leafovert from PerfumersWorld,67845-30-1,0.740,,FALSE,,,
6UT18496,LEATHER F-TEC from PerfumersWorld,mixture,0.450,,FALSE,,,
6UT12424,Leather Fleuressence from PerfumersWorld,mixture,0.370,,FALSE,,,
7CC00271,Lemon Essential Oil from PerfumersWorld,8008-56-8,0.270,,FALSE,,,
6CC18122,LEMON F-TEC from PerfumersWorld,mixture,0.160,,FALSE,,,
7CC24029,Lemon FCF oil Sicilian from PerfumersWorld,68648-39-5,0.180,,FALSE,,,
6CC09059,Lemon Fleuressence from PerfumersWorld,mixture,0.240,,FALSE,,,
7CC24027,Lemon Terpeneless oil Sicilian from PerfumersWorld,68648-39-5,0.440,,FALSE,,,
7CC24031,Lemon Verdello oil Sicilian from PerfumersWorld,8008-56-8,0.180,,FALSE,,,
7CC00272,Lemongrass Essential Oil from PerfumersWorld,8007-02-01,0.210,,FALSE,,,
3CC06770,Lemonile from PerfumersWorld,61792-11-8,0.200,,FALSE,,,
7SY07764,Lesser Galangal Essential Oil from PerfumersWorld,8024-06-04,0.850,,FALSE,,,
6FG18210,LIGHT AND AIRY F-TEC from PerfumersWorld,mixture,0.120,,FALSE,,,
6FG11947,Light and Airy Fleuressence from PerfumersWorld,mixture,0.080,,FALSE,,,
6LJ18322,LIGHT BLENDER F-TEC from PerfumersWorld,mixture,0.150,,FALSE,,,
6LJ09076,Light Blender Fleuressence from PerfumersWorld,mixture,0.300,,FALSE,,,
6LL18018,LIGHT CRISP FLORAL F-TEC from PerfumersWorld,mixture,0.120,,FALSE,,,
6LL00278,Light Crisp Floral Fleuressence from PerfumersWorld,mixture,0.120,,FALSE,,,
6GK18228,LILAC F-TEC from PerfumersWorld,mixture,0.180,,FALSE,,,
6GK09255,Lilac Fleuressence from PerfumersWorld,mixture,0.180,,FALSE,,,
3MA00273,Lilial from PerfumersWorld,80-54-6,0.190,,FALSE,,,
6MA20144,Lilial Substitute IFRA from PerfumersWorld,mixture,0.210,,FALSE,,,
6NN18625,LILY F-TEC from PerfumersWorld,mixture,0.150,,FALSE,,,
6NN09110,Lily Fleuressence from PerfumersWorld,mixture,0.190,,FALSE,,,
6MA22621,Lilylal ND from PerfumersWorld,mixture,0.200,,FALSE,,,
6MG18474,Lilyreal IFRA from PerfumersWorld,mixture,0.230,,FALSE,,,
6MG22777,Lilyreal ND from PerfumersWorld,mixture,0.230,,FALSE,,,
7CK00274,Lime Distilled Essential Oil from PerfumersWorld,8008-26-2,0.330,,FALSE,,,
4CK00275,Lime Oxide from PerfumersWorld,73018-51-6,0.500,,FALSE,,,
5CK21690,Lime Oxide 10% in TEC from PerfumersWorld,"73018-51-6|0.1
77-93-0|0.9",0.080,,TRUE,Lime Oxide from PerfumersWorld,Triethyl Citrate (TEC) from PerfumersWorld,10.00%
6CK18135,LIME ZEST F-TEC from PerfumersWorld,mixture,0.150,,FALSE,,,
6CK12391,Lime Zest Tops Fleuressence from PerfumersWorld,mixture,0.180,,FALSE,,,
4LL00277,Linalool Oxide from PerfumersWorld,1365-19-1,0.600,,FALSE,,,
3LL00278,Linalool Synthetic from PerfumersWorld,78-70-6,0.120,,FALSE,,,
3LF00279,Linalyl Acetate from PerfumersWorld,115-95-7,0.100,,FALSE,,,
3LC12899,Linalyl Propionate from PerfumersWorld,144-39-8,0.320,,FALSE,,,
7CC00280,Litsea Cubeba Essential Oil from PerfumersWorld,68855-99-2,0.190,,FALSE,,,
8NN07699,Lotus Absolute from PerfumersWorld,85085-51-4,19.000,,FALSE,,,
5NN13571,Lotus Absolute 1% in DPG from PerfumersWorld,"85085-51-4|0.01
25265-71-8|0.99",0.510,,TRUE,Lotus Absolute from PerfumersWorld,Dipropylene Glycol (DPG) from PerfumersWorld,1.00%
5NN12069,Lotus Absolute 10% in DPG from PerfumersWorld,"85085-51-4|0.1
25265-71-8|0.9",1.950,,TRUE,Lotus Absolute from PerfumersWorld,Dipropylene Glycol (DPG) from PerfumersWorld,10.00%
8SW08238,Lovage Roots Oil from PerfumersWorld,8016-31-7,8.800,,FALSE,,,
3MG00282,Lyral from PerfumersWorld,31906-04-04,0.230,,FALSE,,,
6MM18498,M-MUGUET F-TEC from PerfumersWorld,mixture,0.180,,FALSE,,,
6MM08681,M-Muguet Fleuressence from PerfumersWorld,mixture,0.200,,FALSE,,,
4GL22835,Maceal from PerfumersWorld,94022-26-5,0.990,,FALSE,,,
5GL23703,Maceal 10% in DPG from PerfumersWorld,"94022-26-5|0.1
25265-71-8|0.9",0.150,,TRUE,Maceal from PerfumersWorld,Dipropylene Glycol (DPG) from PerfumersWorld,10.00%
6XD18354,MACROCYCLIC F-TEC from PerfumersWorld,mixture,0.150,,FALSE,,,
6XD09426,Macrocyclic Fleuressence from PerfumersWorld,mixture,0.190,,FALSE,,,
2XX14556,Macrolide from PerfumersWorld,105-95-3,1.120,,FALSE,,,
3MN13569,Magnolan from PerfumersWorld,27606-14-6,0.600,,FALSE,,,
6CL18121,MALE FLORAL F-TEC from PerfumersWorld,mixture,0.150,,FALSE,,,
6CL10386,Male Floral Fleuressence from PerfumersWorld,mixture,0.200,,FALSE,,,
6WC18598,MALE WOODSY F-TEC from PerfumersWorld,mixture,0.150,,FALSE,,,
6WC12407,Male Woodsy Fleuressence from PerfumersWorld,mixture,0.270,,FALSE,,,
1VE00283,Maltol from PerfumersWorld,118-71-8,0.320,,FALSE,,,
5VE08421,Maltol 1% in DPG from PerfumersWorld,"118-71-8|0.01
25265-71-8|0.99",0.060,,TRUE,Maltol from PerfumersWorld,Dipropylene Glycol (DPG) from PerfumersWorld,1.00%
5VE10963,Maltol 5% in DPG from PerfumersWorld,"118-71-8|0.05
25265-71-8|0.95",0.100,,TRUE,Maltol from PerfumersWorld,Dipropylene Glycol (DPG) from PerfumersWorld,5.00%
7CA00285,Mandarin Essential Oil from PerfumersWorld,8008-31-9,0.300,,FALSE,,,
6CA18124,MANDARIN F-TEC from PerfumersWorld,mixture,0.160,,FALSE,,,
6CA09060,Mandarin Fleuressence from PerfumersWorld,mixture,0.150,,FALSE,,,
6FV18841,MANGO F-TEC from PerfumersWorld,mixture,0.120,,FALSE,,,
6FV10907,Mango Fleuressence from PerfumersWorld,mixture,0.170,,FALSE,,,
7HP07679,Manuka Essential Oil from PerfumersWorld,2222-23-3,3.300,,FALSE,,,
4FG15438,Manzanate from PerfumersWorld,39255-32-8,0.280,,FALSE,,,
1VE00286,Maple Lactone from PerfumersWorld,0698-10-2,0.710,,FALSE,,,
5VE09632,Maple Lactone 10% in DPG from PerfumersWorld,"698-10-2|0.1
25265-71-8|0.9",0.100,,TRUE,Maple Lactone from PerfumersWorld,Dipropylene Glycol (DPG) from PerfumersWorld,10.00%
8HE00557,Mate Absolute from PerfumersWorld,68916-96-1,7.400,,FALSE,,,
5HE13845,Mate Absolute 10% in DPG from PerfumersWorld,"68916-96-1|0.1
25265-71-8|0.9",0.800,,TRUE,Mate Absolute from PerfumersWorld,Dipropylene Glycol (DPG) from PerfumersWorld,10.00%
3MG11691,Mayol from PerfumersWorld,13828-37-0,0.350,,FALSE,,,
6GF18175,MELON F-TEC from PerfumersWorld,mixture,0.120,,FALSE,,,
6FG08392,Melon Fleuressence from PerfumersWorld,mixture,0.200,,FALSE,,,
4FG00289,Melonal from PerfumersWorld,106-72-9,1.000,,FALSE,,,
5FG08480,Melonal 10% in DPG from PerfumersWorld,"106-72-9|0.1
25265-71-8|0.9",0.140,,TRUE,Melonal from PerfumersWorld,Dipropylene Glycol (DPG) from PerfumersWorld,10.00%
1BB00290,Menthol Crystals from PerfumersWorld,2216-51-5,0.160,,FALSE,,,
5BB08460,Menthol Crystals 50% in DPG from PerfumersWorld,"2216-51-5|0.5
25265-71-8|0.5",0.110,,TRUE,Menthol Crystals from PerfumersWorld,Dipropylene Glycol (DPG) from PerfumersWorld,50.00%
4BB00291,Menthone from PerfumersWorld,89-80-5,0.400,,FALSE,,,
5BB08203,Menthone 10% in DPG from PerfumersWorld,"89-80-5|0.1
25265-71-8|0.9",0.090,,TRUE,Menthone from PerfumersWorld,Dipropylene Glycol (DPG) from PerfumersWorld,10.00%
3LB00292,Menthyl Acetate from PerfumersWorld,89-48-5,0.320,,FALSE,,,
4LF00294,Methyl Amyl Ketone from PerfumersWorld,110-43-0,0.230,,FALSE,,,
4NC00295,Methyl Anthranilate from PerfumersWorld,134-20-3,0.120,,FALSE,,,
5NC12471,Methyl Anthranilate 10% in DPG from PerfumersWorld,"134-20-3|0.1
25265-71-8|0.9",0.040,,TRUE,Methyl Anthranilate from PerfumersWorld,Dipropylene Glycol (DPG) from PerfumersWorld,10.00%
4NJ00296,Methyl Benzoate from PerfumersWorld,93-58-3,0.070,,FALSE,,,
5NJ07849,Methyl Benzoate 10% in DPG from PerfumersWorld,"93-58-3|0.1
25265-71-8|0.9",0.040,,TRUE,Methyl Benzoate from PerfumersWorld,Dipropylene Glycol (DPG) from PerfumersWorld,10.00%
4PS02272,Methyl Chavicol from PerfumersWorld,140-67-0,0.620,,FALSE,,,
5PS07822,Methyl Chavicol 10% in DPG from PerfumersWorld,"140-67-0|0.1
25265-71-8|0.9",0.120,,TRUE,Methyl Chavicol from PerfumersWorld,Dipropylene Glycol (DPG) from PerfumersWorld,10.00%
2SC00297,Methyl Cinnamate from PerfumersWorld,103-26-4,0.240,,FALSE,,,
5SC12482,Methyl Cinnamate 10% in DPG from PerfumersWorld,"103-26-4|0.1
25265-71-8|0.9",0.050,,TRUE,Methyl Cinnamate from PerfumersWorld,Dipropylene Glycol (DPG) from PerfumersWorld,10.00%
5SC07858,Methyl cinnamate 50% in DPG from PerfumersWorld,"103-26-4|0.5
25265-71-8|0.5",0.140,,TRUE,Methyl Cinnamate from PerfumersWorld,Dipropylene Glycol (DPG) from PerfumersWorld,50.00%
4SP16859,Methyl Diantilis from PerfumersWorld,5595-79-9,0.990,,FALSE,,,
9SW00298,Methyl Eugenol from PerfumersWorld,93-15-2,0.350,,FALSE,,,
3LF00299,Methyl Hexyl Ketone from PerfumersWorld,111-13-7,0.120,,FALSE,,,
9SP02300,Methyl Isoeugenol from PerfumersWorld,93-16-3,0.410,,FALSE,,,
4JN15333,Methyl Jasmonate from PerfumersWorld,1211-29-6,12.800,,FALSE,,,
5VD10871,METHYL LAITONE 10% DPG from PerfumersWorld,"94201-17-1|0.1
25265-71-8|0.9",0.500,,FALSE,,,
4LY00304,Methyl Nonyl Ketone from PerfumersWorld,0112-12-9,0.320,,FALSE,,,
4GI00305,Methyl Octine Carbonate from PerfumersWorld,111-80-8,1.230,,FALSE,,,
5GI07522,Methyl Octine Carbonate 10% in DPG from PerfumersWorld,"111-80-8|0.1
25265-71-8|0.9",0.150,,TRUE,Methyl Octine Carbonate from PerfumersWorld,Dipropylene Glycol (DPG) from PerfumersWorld,10.00%
4FC11677,Methyl Pample Mousse from PerfumersWorld,22457-35-6,1.060,,FALSE,,,
5FC19406,Methyl Pamplemousse 10% in TEC from PerfumersWorld,"22457-35-6|0.1
77-93-0|0.9",0.200,,TRUE,Methyl Pample Mousse from PerfumersWorld,Triethyl Citrate (TEC) from PerfumersWorld,10.00%
3OP00306,Methyl Salicylate from PerfumersWorld,119-36-8,0.080,,FALSE,,,
5OP07554,Methyl Salicylate 10% in DPG from PerfumersWorld,"119-36-8|0.1
25265-71-8|0.9",0.040,,TRUE,Methyl Salicylate from PerfumersWorld,Dipropylene Glycol (DPG) from PerfumersWorld,10.00%
6DD18140,MILK F-TEC from PerfumersWorld,mixture,0.120,,FALSE,,,
6DD09086,Milk Fleuressence from PerfumersWorld,mixture,0.190,,FALSE,,,
8NG00307,Mimosa Absolute from PerfumersWorld,8031-03-06,7.120,,FALSE,,,
5NG07850,Mimosa Absolute 10% in DPG from PerfumersWorld,"8031-03-6|0.1
25265-71-8|0.9",0.750,,TRUE,Mimosa Absolute from PerfumersWorld,Dipropylene Glycol (DPG) from PerfumersWorld,10.00%
6NN18760,MIMOSA F-TEC from PerfumersWorld,mixture,0.220,,FALSE,,,
6NN09420,Mimosa Fleuressence from PerfumersWorld,mixture,0.200,,FALSE,,,
4XU05022,Muscone from PerfumersWorld,541-91-3,4.500,,FALSE,,,
6YE18885,MUSHROOM F-TEC from PerfumersWorld,mixture,0.500,,FALSE,,,
6YE09107,Mushroom Fleuressence from PerfumersWorld,mixture,0.220,,FALSE,,,
2XA09558,Musk Concentrate from PerfumersWorld,mixture,0.190,,FALSE,,,
1XU00308,Musk Ketone from PerfumersWorld,81-14-1,0.200,,FALSE,,,
5XU07864,Musk Ketone 10% in DEP from PerfumersWorld,"81-14-1|0.1
84-66-2|0.9",0.060,,TRUE,Musk Ketone from PerfumersWorld,Diethyl Phthalate (DEP) from PerfumersWorld,10.00%
5XU09977,Musk Ketone 10% in DPG from PerfumersWorld,"81-14-1|0.1
25265-71-8|0.9",0.060,,TRUE,Musk Ketone from PerfumersWorld,Dipropylene Glycol (DPG) from PerfumersWorld,10.00%
6XY17557,Musk X Super from PerfumersWorld,mixture,0.300,,FALSE,,,
6XU17558,Musk Xylol REP from PerfumersWorld,mixture,0.310,,FALSE,,,
4MA00312,Myrac Aldehyde from PerfumersWorld,6048-83-5,0.180,,FALSE,,,
5MA08478,Myrac Aldehyde 10% in DPG from PerfumersWorld,"6048-83-5|0.1
25265-71-8|0.9",0.060,,TRUE,Myrac Aldehyde from PerfumersWorld,Dipropylene Glycol (DPG) from PerfumersWorld,10.00%
3CQ00313,Myrcene from PerfumersWorld,123-35-3,0.450,,FALSE,,,
1AA05031,Myristic Acid from PerfumersWorld,544-63-8,0.180,,FALSE,,,
7QC00314,Myrrh Essential Oil from PerfumersWorld,8016-37-3,3.020,,FALSE,,,
6NJ18033,N-NARCOTIC F-TEC from PerfumersWorld,mixture,0.150,,FALSE,,,
6NJ07696,N-Narcotic Fleuressence from PerfumersWorld,mixture,0.210,,FALSE,,,
7WU09815,Nagarmotha Oil from PerfumersWorld,68916-60-9,1.600,,FALSE,,,
6NP18957,NARCISSUS F-TEC from PerfumersWorld,mixture,0.180,,FALSE,,,
6NP08694,Narcissus Fleuressence from PerfumersWorld,mixture,0.360,,FALSE,,,
6GL18214,NATURELLE F-TEC from PerfumersWorld,mixture,0.180,,FALSE,,,
